ID,标签,问题,答案
0,0,允许转出中澳班的时间以及需要达到的条件是什么？在中澳班中则必须3年后出国学习吗？,无强制出国，可以直接本科毕业
1,0,老师好，招生章程中是不是除了有提及的身体特征有限报专业的情况（例如色弱色盲不能报的专业），其他没有提及的身体特征就可以报贵校所有专业？谢谢老师！,是的
2,0,您好，我已查阅招生章程，想确认一下，贵校是否没有单科成绩要求限制,无单科要求
3,0,老师好，广东考生，想了解下，其他专业如果转入建筑学，是不是要多读一年，即共读6年，谢谢老师,是的，需要降级
4,0,如果计划没有满，服从调剂，会招收排位很低的学生吗,平行志愿符合录取不退档
5,0,请问你校少数民族预科班四川分数线是多少？,每年变化较大，最多优惠到录取线下80分内
6,0,你好，请问在内蒙古提档比例是多少？提档后身体条件符合学校要求服从调剂是否承诺不退档？,一般1:1
7,0,山西考生理科614，位次2741，能报贵校的什么专业,可参照山西-2020年普通类高考录取分数统计http://admission.scut.edu.cn/2020/1027/c17520a406226/page.htm
8,0,请问计算机类(计算机科学与技术、网络工程、信息安全)和自动化(创新班)和软件工程对视力有要求么,已明确在华南理工大学2021年本科招生章程http://admission.scut.edu.cn/2021/0608/c17543a432351/page.htm
9,0,1.请问有设置专业级差吗2.请问新高考无调剂是否会有因除体检以外的原因提档后被退档,1无级差2.存在可能性
10,0,请问通过国家专项进贵校的和普通批次的有什么区别？例如是否可以转专业,针对群体不同都可以
11,0,机械类里有车辆工程专业吗？云南考生628分，排2666名能有望被录取吗？,入学一年后分专业
12,0,老师好，想报建筑学，有什么身体限制？风景园林又有什么身体限制？谢谢老师,华南理工大学2021年本科招生章程http://admission.scut.edu.cn/2021/0608/c17543a432351/page.htm
13,0,老师，您好，我是云南考生，我想问一下机械类里有车辆工程专业吗？628分，排名2666，报贵校有望被录取吗？,http://admission.scut.edu.cn/2020/1027/c17520a406374/page.htm云南-2020年普通类高考录取分数统计
14,0,老师好，华工的建筑学院内的专业是不是不能互转？谢谢老师,不能
15,0,635有机会吗,有机会
16,0,635，四川.6672名有机会吗？,有机会
17,0,河南招生老师的电话是多少？,13016050071
18,0,您好，我是河南理科考生，今年649分，省排4630名，请问有把握冲击本校吗？对专业选择性大吗？,建议报考河南-2020年普通类高考录取分数统计http://admission.scut.edu.cn/2020/1027/c17520a406100/page.htm
19,0,河北考生，选考物理、化学、生物，排名6287，经管类专业录取机率大吗？另外贵校的保研率是多少？,改革第一年，建议报考，保研率20%左右
20,0,请问贵校住宿条件怎么样,4人间，独立卫浴为主
21,0,新疆，女，理科，595分，位次797，有希望被贵校录取吗,建议报考
22,0,地方专项计划,我校无地方专项
23,0,湖南考生，623分，全省5088名，可以填报贵校什么专业？麻烦给个参考。能够冲击一下搏一搏的专业也可告知一下。,http://admission.scut.edu.cn/2021/0609/c17543a432607/page.htm华南理工大学2021年本科分省分专业计划（湖南）http://admission.scut.edu.cn/2020/1027/c17520a406122/page.htm湖南-2020年普通类高考录取分数统计
24,0,广东考生有报高校专项计划志愿，物理类4万名有希望进入贵校吗志愿是医学影像学,每年浮动很大，建议报考
25,0,所以贵校招生章程里说的专业以文化成绩为准是不包括政策性加分么,（二）加分政策的处理办法：承认各省级招生考试机构认定符合教育部加分政策的考生的投档成绩，最高加分不超过20分；安排专业志愿时以考生高考文化成绩为准。我校在录取时对获得各类政策性加分的考生不作累计加分。所有高考加分项目及分值不适用于不安排分省分专业招生计划的招生项目。
26,0,化学类，化学工程与制药，轻工类有什么身体限制吗看了招生简章但是不是很确定,限制色盲色弱
27,0,陕西理科602分，4662位次，能报贵校的人工智能吗？如果不行，能报哪些专业？,参照上年度录取分数http://admission.scut.edu.cn/2020/1027/c17520a406234/page.htm
28,0,高校专项计划初审通过，分数达到一本线就可以在提前一批报了么,http://admission.scut.edu.cn/2021/0411/c17748a425246/page.htm华南理工大学2021年高校专项“筑梦计划”招生简章
29,0,老师您好。我是江西考生。我的高考成绩是629，排名为3049，是否有机会报考华南理工，能报考什么专业呢？,http://admission.scut.edu.cn/2021/0608/c17543a432447/page.htm华南理工大学2021年本科分省分专业计划（江西）
30,0,您好，请问贵校数学系对高考数学分数有什么要求,没有
31,0,老师好，请问贵校的院校专业组和对应学科要求可以在哪里查询？,华南理工大学招生办网站http://admission.scut.edu.cn/2021/0612/c17543a432968/page.htm
32,0,请问既往病史青斑样血管炎，症状脚部皮肤损伤，对入读贵校有影响吗？,身体健康状况要求：原则上执行教育部、卫生部、中国残疾人联合会颁发的《普通高等学校招生体检工作指导意见》和人力资源和社会保障部、教育部、卫生部《关于进一步规范入学和就业体检项目维护乙肝表面抗原携带者入学和就业权利的通知》等有关要求，体检不合格者不予录取。新生入学后进行体检复查（色...[详细]
33,0,请问甘肃理科高考575，省排名2926，能否通过本科提前批B段被贵校录取？,http://admission.scut.edu.cn/2020/0811/c17520a391643/page.htm参考上年分数看看
34,0,老师，您好！我想咨询一下贵校的传播学2+2联合培养班具体是怎样的培养模式？,http://admission.scut.edu.cn/2021/0616/c17525a433222/page.htm华南理工大学2021年本科招生资讯册
35,0,报了专业之后才发现身体条件不允许但是填了遵循调剂，最后是直接退档还是志愿调剂,不同批次要求不同http://admission.scut.edu.cn/2021/0608/c17543a432351/page.htm详细阅读简章
36,0,专业认不认民族加分,（二）加分政策的处理办法：承认各省级招生考试机构认定符合教育部加分政策的考生的投档成绩，最高加分不超过20分；安排专业志愿时以考生高考文化成绩为准。我校在录取时对获得各类政策性加分的考生不作累计加分。所有高考加分项目及分值不适用于不安排分省分专业招生计划的招生项目。
37,0,想问一下贵校提档比例是1:1吗？进校后可以转专业吗？如果转专业需要什么条件吗？,http://admission.scut.edu.cn/2021/0113/c17747a419033/page.htm华南理工大学2021年艺术学院本科招生简章
38,0,您好！请问如果身体健康状况属于不宜就读的情况（高度近视，其余均正常），在分数达线的情况下能否被贵校临床医学专业录取？谢谢。,http://admission.scut.edu.cn/2021/0608/c17543a432351/page.htm华南理工大学2021年本科招生章程临床医学不招色盲色弱
39,0,您好，请问计算机大类招生的，1、在校读几年划分小专业；2、小专业是按成绩高低划分还是随机划分；3、毕业证以后写的是计算机大类专业还是小专业。,http://admission.scut.edu.cn/2021/0616/c17525a433222/page.htm请详细阅读资讯册中计算机学院部分
40,0,请问贵校今年在海南招生选物科目的各专业对色弱有无限制，若有是哪些？若提档会不会因色弱可能退档（服从调剂）？,http://admission.scut.edu.cn/2021/0608/c17543a432351/page.htm华南理工大学2021年本科招生章程请详细阅读招生章程，报考时不要填报所列专业
41,0,您好，请问计算机大类招生的，1、在校读几年划分小专业；2、小专业是按成绩高低划分还是随机划分；3、毕业证以后写的是计算机大类专业还是小专业。,http://admission.scut.edu.cn/2021/0616/c17525a433222/page.htm请详细阅读资讯册中计算机学院部分
42,0,请问：广东考试综评招生面试结果什么时候可以收到通知？谢谢老师,http://admission.scut.edu.cn/2021/0406/c17748a424543/page.htm华南理工大学2021年广东省综合评价招生简章请详细阅读简章，注意各时间节点及要求
43,0,请问贵校何时出录取分数线？何时出每个专业的录取分数线？应该在哪查询？大概在多少位次可以投档贵校,各专业在考生填报录取后才有分数线目前都是参考上年分数线报考http://admission.scut.edu.cn/2020/1027/c17520a406405/page.htm
44,0,这个专业在广东省内今年招多少人？,综合评价方式录取，具体查询简章http://admission.scut.edu.cn/2021/0406/c17748a424543/page.htm
45,0,同上,学校统一分配（六）住宿费：600~1600元/生·学年。
46,0,同上,国家专项，高校转向等相关专业，具体查询所在省招办发招生指南
47,0,请问广东考生报考华工艺术学院音乐学专业是提前批次吗,本科批统+校
48,0,是先录统考学校吗那如果我报的统考学校被录取了华工还会录我吗,不会
49,0,孩子是天津2020届考生，总成绩638位次6781物化生能否报考贵校,http://admission.scut.edu.cn/2020/0529/c17520a379341/page.htm参照去年分数排位，注意拉开梯度
50,0,你好，我是福建考生，总是634排名3441有希望报考贵校吗,http://admission.scut.edu.cn/2020/0529/c17520a379341/page.htm参照去年分数排位，注意拉开梯度
51,0,您好！请问录取规则中“符合专业录取要求”具体是指一些专业对身体、单科成绩和语种等等的要求吗？,是的
52,0,广东理616分报贵校工业设计有可能被录取吗？,http://admission.scut.edu.cn/2020/0529/c17520a379341/page.htm参照去年分数排位，注意拉开梯度
53,0,老师您好，我是河北考生，省排位次为5561，能被贵校录取吗？能录取的话，选择什么样的专业呢？,http://admission.scut.edu.cn/2020/0529/c17520a379341/page.htm参照去年分数排位，注意拉开梯度
54,0,老师您好，我是河南文科考生，627分，位次1221，请问报考贵校录取概率有多大？建议报考吗？,http://admission.scut.edu.cn/2020/0529/c17520a379341/page.htm参照去年分数排位，注意拉开梯度
55,0,您好，我是今年天津的毕业生，我所选的科目是物理化学生物，我的总成绩是638分，请问我是否有希望进入贵校？若报考贵校是否存在专业级差？,http://admission.scut.edu.cn/2020/0529/c17520a379341/page.htm参照去年分数排位，注意拉开梯度无极差
56,0,您好老师，我是河北考生，理科，658分，省排位4500-4750，报考贵校录取的可能性大吗？,http://admission.scut.edu.cn/2020/0529/c17520a379341/page.htm参照去年分数排位，注意拉开梯度
57,0,请问贵校文科2017-2019年在贵州的录取分数线及排位？谢谢！,http://admission.scut.edu.cn/2020/0529/c17520a379341/page.htm参照去年分数排位，注意拉开梯度
58,0,音乐专业的考生填志愿填华南理工大学时是填在统考+校考那里的但是前面还有一个是统考的学校如果我统考也填了学校被录取之后华南理工还能录取到我吗,不能
59,0,您好，请问贵校今年在海南招生分数线或录取位次估计大概是多少呢？,新高考改革第一年暂无参照。
60,0,山东考生635，位次在8646，可以冲一冲吗，几率有多大,http://admission.scut.edu.cn/2020/0523/c17520a378749/page.htm参考2019年专业
61,0,老师，您好，福建理科考生，高考614分，排名6436，有希望被录取吗？,http://admission.scut.edu.cn/2020/0523/c17520a378726/page.htm参考往年排位
62,0,请问传播学2+2是不是中外合作办学？,"不是，联合班。学费6060,，2年后如出国参照合作高校标准。"
63,0,老师您好！请问经济学（创新班）本硕连读是不是只能在本学校（华南理工大学）连读本硕？,是的
64,0,老师您好！请问传播学（2+2联合班）是学什么的？具体培养模式是什么？学费是多少？是中外合资吗？谢谢老师,我校开展传播学（2+2联合班），合作高校为美国密苏里大学哥伦比亚校区（UniversityofMissouri-Columbia）。学生第一、二年在我校学习，培养计划参照密苏里大学对应专业前两年的课程模块，与密苏里大学共同制定。部分核心专业课程与通识教育课程原则上采用全英文教学。在达到密苏里大学有关绩点...[详细]
65,0,天津654，4204位，报考贵校05922，05924专业组机会大吗？谢谢,http://admission.scut.edu.cn/2020/0529/c17520a379341/page.htm参照去年分数排位，注意拉开梯度
66,0,河南文科考生，623，位次1563，有希望被贵校录取吗？,http://admission.scut.edu.cn/2020/0529/c17520a379341/page.htm参照去年分数排位，注意拉开梯度
67,0,我是山东省美术类考生，山东省美术统考成绩255.34分，高考文化课成绩432分，山东省美术类综合分576.45分，能被贵校录取吗？,http://admission.scut.edu.cn/2020/0529/c17520a379341/page.htm参照去年分数排位，注意拉开梯度
68,0,贵州省考生分数582排名8523能否录取你们学校?谢谢,http://admission.scut.edu.cn/2020/0529/c17520a379341/page.htm参照去年分数排位，注意拉开梯度
69,0,天津649，物理总位次3639，录取希望怎样,http://admission.scut.edu.cn/2020/0529/c17520a379341/page.htm参照去年分数排位，注意拉开梯度
70,0,关于贵校的城乡规划专业，入学后需加试素描有什么要求？如果没有素描基础会有退档可能吗？,加试素描第二十一条  加试要求：录取至建筑学、城乡规划、风景园林三个专业的考生，入校后需加试素描。素描成绩不合格者将参照我校当年各专业在生源地录取分数线及考生高考志愿，依据高考文化成绩，按照高分转低分的原则结合招生计划数，调入新专业。不同意学校安排者予以取消入学资格。
71,0,老师您好，我是北京的考生，请问628分报考咱们学校的04专业组有希望么？谢谢,http://admission.scut.edu.cn/2020/0529/c17520a379341/page.htm参照去年分数排位，注意拉开梯度
72,0,你好老师，我是今年广东高考生，分数639全省理科排名5682名，今年听说全省理科6000名以内报考贵校可以实现零调剂，那我是否可以在六个专业中选择你们贵校排名三四千名排位的专业，我可以在这六个专业中实现零调剂录取吗？,http://admission.scut.edu.cn/2020/0529/c17520a379341/page.htm参照去年分数排位，注意拉开梯度
73,0,贵校公布的音乐表演器乐演奏专业分省计划，广东共有19个录取计划，但这19个录取计划没有细分“弦乐、管乐、竖琴、西洋打击乐、民族乐器演奏”等各招多少。我想了解广东的19个录取计划中，有无对应以上器乐种类的细分计划？其中民族器乐演奏招几个？,华南理工大学2020年艺术学院本科招生简章http://admission.scut.edu.cn/2019/1228/c17747a360339/page.htm我校音乐类专业计划采用文理综合编制的原则，不区分考生文理科类。考生在取得省专业统考合格证书（高考所在省份未组织统一考试除外）、文化考试成绩达到高考所在省艺术类同批次录取最低控制分数...[详细]
74,0,请问通过高校专项录取的考生可以在大一转专业吗,符合要求的可以
75,0,福建考生，分数622，排名5043，有机会通过高校专项计划录取贵校吗,http://admission.scut.edu.cn/2020/0529/c17520a379341/page.htm参照去年分数排位，注意拉开梯度
76,0,请问一下贵州考生2019年二次补报的原因？,http://admission.scut.edu.cn/2020/0529/c17520a379341/page.htm参照去年分数排位，注意拉开梯度
77,0,老师，您好，福建理科考生，高考614分，排名6436，有希望被录取吗？,http://admission.scut.edu.cn/2020/0529/c17520a379341/page.htm参照去年分数排位，注意拉开梯度
78,0,老师：请问青海文科排位330位，报该校有希望吗？,http://admission.scut.edu.cn/2020/0529/c17520a379341/page.htm参照去年分数排位，注意拉开梯度
79,0,您好，我是河南考生，分数645分，位次11903，想通过国家专项计划填报贵校，请问被录取的几率大概是多少？,http://admission.scut.edu.cn/2020/0529/c17520a379341/page.htm参照去年分数排位，注意拉开梯度
80,0,北京3378名能否进贵校，如果可以能进什么专业，入校后转专业有什么要求，3+2中澳班是什么情况,我校与澳大利亚西澳大学（TheUniversityofWesternAustralia）在电力学院电气工程及其自动化、环境与能源学院环境工程及软件学院软件工程开展三个“3+2”本硕连读联合班。学生前三年在我校学习，培养计划参照我校对应专业前三年的课程模块，与西澳大学共同制定。部分核心专业课程与通识教育课...[详细]
81,0,可以的话，可以报考哪些专业,http://admission.scut.edu.cn/2020/0529/c17520a379341/page.htm参照去年分数排位，注意拉开梯度
82,0,招生章程的录取批次里的第一批，第一段，本科批有什么不同,各省叫法
83,0,河南文科考生，623，位次1563，有希望被贵校录取吗？,http://admission.scut.edu.cn/2020/0523/c17520a378732/page.htm
84,0,您好，山东考生，物化地，644分综合排名5922名，请问报考贵校哪些专业比较有希望？,http://admission.scut.edu.cn/2020/0523/c17520a378749/page.htm
85,0,老师您好，我是一名福建考生，排名3171。1.请问我这个成绩能否有机会被贵校录取？2.能否给予我一些填报建议？3.问下贵校入学后转专业的条件。4.请问下福建招生负责人的联系方式。谢谢您！,黄老师15622134260
86,0,请问报考贵校建筑学得多少位次？,郭老师15622135443
87,0,老师您好！我是河南考生，理科，659分，报考贵校的国家专项计划有可能被录取吗？烦请给以指导！谢谢！您辛苦了！,http://admission.scut.edu.cn/2020/0529/c17520a379341/page.htm参照去年分数排位，注意拉开梯度
88,0,西藏理科藏族考生379（其中含政策加分10分）有望考上贵校吗省位次376,http://admission.scut.edu.cn/2020/0529/c17520a379341/page.htm参照去年分数排位，注意拉开梯度
89,0,老师好，请问色弱可以报哪些专业？谢谢！,http://admission.scut.edu.cn/2020/0701/c17543a388774/page.htm详见章程
90,0,贵校最好的专业及历年录取排名如何,华南理工大学
91,0,贵校最好的专业及历年录取排名如何,我校是华南理工大学
92,0,贵校最好的专业及历年录取排名如何,历年录取统计http://admission.scut.edu.cn/17520/list.htm
93,0,青海文科242名报考贵校的新传或者法学有优势吗？文科需要学多长时间数学？,韩老师15622158993
94,0,"我是广东理科考生，总分634,排名6899,有机会被华南理工信息工程录取吗？还有，软件学院(3+2中澳班)有机会转为平行班吗？",http://admission.scut.edu.cn/2020/0529/c17520a379341/page.htm参照去年分数排位，注意拉开梯度
95,0,你好老师，贵州文科629分（含10分加分）省排659，能否报考贵校新闻传播学专业？调档是否会退档？谢谢,http://admission.scut.edu.cn/2020/0529/c17520a379341/page.htm参照去年分数排位，注意拉开梯度
96,0,上海考生，556分排位4100，入贵校的风景园林概率大吗？入校后可以转入建筑学专业吗？门槛如何？保研可保到同济吗，保研率多少？,建筑学院内专业不能互转保研20%
97,0,你好老师，贵州文科629分（含10分加分）省排659，报考贵州传播学专业，有没有希望录取,http://admission.scut.edu.cn/2020/0529/c17520a379341/page.htm参照去年分数排位，注意拉开梯度
98,0,请问贵校在河北各专业录取名次会有变动吗?变动大吗?,覃老师15622104470
99,0,请问一下指导意见上写的“不能准确在显示器上识别红黄绿蓝紫各种颜色中任何一种颜色的数码，字母”是什么意思？,单色识别不全
100,0,老师您好，天津考生哪个位次报考？,http://admission.scut.edu.cn/2020/0529/c17520a379341/page.htm参照去年分数排位，注意拉开梯度
101,0,请问贵校在服从专业调剂的情况下，是否会有退档的情况,平行志愿批次普通类考生出档后，服从调剂且符合专业录取要求者不退档。
102,0,湖南舞蹈考生专业成绩没有达到湖南省最低控制线可以报考贵校吗,http://admission.scut.edu.cn/2019/0708/c17520a327241/page.htm
103,0,你好，黑龙江考生613分有希望报考贵校吗？,http://admission.scut.edu.cn/2020/0523/c17520a378733/page.htm
104,0,河北省考生640分国家专项可以报贵校吗？录取有希望吗,http://admission.scut.edu.cn/2019/0708/c17520a327240/page.htm
105,0,河南理科650分9653位贵校的国家专项能录取吗！谢谢！,http://admission.scut.edu.cn/2019/0708/c17520a327240/page.htm
106,0,四川理科650分，4990名，请问报考贵校概率大吗？,http://admission.scut.edu.cn/2020/0523/c17520a378753/page.htm
107,0,江西考生，排名1892，录取贵校的建筑专业概率大吗,http://admission.scut.edu.cn/2020/0523/c17520a378738/page.htm
108,0,请问开学加试美术专业需要什么水平,http://admission.scut.edu.cn/2020/0523/c17520a378738/page.htm
109,0,河南考生理科664，4878名，能入贵校吗？,http://admission.scut.edu.cn/2020/0523/c17520a378732/page.htm
110,0,您好，请问广东省理科排位20000能否报贵校化学系专业，是否会与贵校无缘,http://admission.scut.edu.cn/2019/0718/c17520a328738/page.htm
111,0,老师好！甘肃理工2247名，599分有没有可能冲击一下？,http://admission.scut.edu.cn/2020/0523/c17520a378727/page.htm
112,0,老师，请问贵校计算机专业在云南招生的排名大约是多少？,http://admission.scut.edu.cn/2020/0523/c17520a378756/page.htm
113,0,请问老师福建考生632分，排名3735名，有机会录取贵校吗？,http://admission.scut.edu.cn/2020/0529/c17520a379341/page.htm参照去年分数排位，注意拉开梯度
114,0,老师请问一下湖南舞蹈考生的最低录取分数线是多少呀,http://admission.scut.edu.cn/2019/0708/c17520a327241/page.htm
115,0,我是一名河南理科考生，641分走国家专项计划有机会进贵校吗？,http://admission.scut.edu.cn/2020/0529/c17520a379341/page.htm参照去年分数排位，注意拉开梯度
116,0,湖南省艺术生招生时分数录取分文理吗,http://admission.scut.edu.cn/2019/0708/c17520a327241/page.htm看报考指南
117,0,老师好，我总分638，省排名4500，请问可以报哪些专业？电气和计算机能报吗？谢谢,http://admission.scut.edu.cn/2020/0529/c17520a379341/page.htm参照去年分数排位，注意拉开梯度
118,0,老师您好湖南考生653想报考贵校网络工程专业机会大吗？,http://admission.scut.edu.cn/2020/0529/c17520a379341/page.htm参照去年分数排位，注意拉开梯度
119,0,老师好！我是江西宜春考生颜瑄皓理科638分，排名2892，问：1、有机会录取贵校吗？2、本科一批专业录取是分数优先？还是志愿优先？3、优势专业及填报建议？4、入校后是否可转专业？有何条件？5、江西招生负责人联系方式？,http://admission.scut.edu.cn/2020/0529/c17520a379341/page.htm参照去年分数排位，注意拉开梯度分数优先
120,0,综合评价拟录取名单是指达到填报贵校志愿要求，可以在提前批填报该校吗,广东省特殊类批，综合评价栏填报
121,0,老师好，能否提供华南理工各专业历年在江西的录取分数线及排位，谢谢！,http://admission.scut.edu.cn/2020/0523/c17520a378738/page.htm
122,0,河南省理科分数667，位次4082，报考本校什么专业能录取,http://admission.scut.edu.cn/2020/0529/c17520a379341/page.htm参照去年分数排位，注意拉开梯度
123,0,我是广东考生，想报考舞蹈专业，我的综合分位次474，是不是彻底没希望了!?,http://admission.scut.edu.cn/2019/0708/c17520a327241/page.htm
124,0,请问你校2018年和2017年舞蹈专业最低录取排位是多少呢？,http://admission.scut.edu.cn/2019/0708/c17520a327241/page.htm
125,0,招生办的老师，您好，我是广东理工科考生，成绩527，服从调配，请问有机会被贵校录取吗？,http://admission.scut.edu.cn/2020/0529/c17520a379341/page.htm参照去年分数排位，注意拉开梯度
126,0,老师您好，我是河南考生，报的高校专项，初审已经通过。请问我今年高考分数640请问有希望进贵校吗？,http://admission.scut.edu.cn/2020/0529/c17520a379341/page.htm参照去年分数排位，注意拉开梯度
127,0,1.河南考生理科670分，省排名3375，报贵校的计算机类、电子信息专业有希望录取吗？2.能转专业吗？概率有多大？,http://admission.scut.edu.cn/2020/0529/c17520a379341/page.htm参照去年分数排位，注意拉开梯度
