ID,标签,问题,答案276,0,您好，贵校已经通知采取线上考试，那么可否钢琴伴奏？对于着装有什么要求？,伴奏请咨询艺术学院020-39380901。着装没有要求
277,0,若不想参加贵校线上考试能否退费,交费后目前是不能退费的
278,0,缴费成功后什么时候打印准考证呀,请关注系统时间
279,0,您好，我是甘肃的声乐考生，贵校已经发文通知采取线上考试的方式，那么请问声乐考试有钢琴伴奏吗？,我校不提供，更多可咨询艺术学院020-39380901
280,0,请问四川音乐表演（钢琴）的学生现在再哪个网站报名,报名已经结束
281,0,我在特殊阳光高考官网报了名但是我不知道我报的是那个地区考上面没有显示是兰州和广州考点,广州考点
282,0,老师您好，今年贵校在山东的录取批次由之前的提前批更改到了本科批，我想问一下，美术类考生大约在一个怎样的位次才能报考贵校？以前的录取分数还能做参考吗？,平行志愿，没有参照。但是也给了冲报的机会
283,0,1请问音乐表演专业初试曲目需要完整演奏完一首曲子吗？2请问远程视频操作入口在哪里？根据昨天简章给出的操作网址（https://bm.chsi.com.cn/）我找不到入口。,系统尚未开放，请继续关注
284,0,声乐美声考试，需伴奏还是清唱？,可以清唱
285,0,网上考试的具体操作出来了吗？我刚登陆那个网站，上面没有操作详情.,还没有，请继续关注
286,0,器乐类民族乐器考试是否可以弹选段有时间限制吗,请关注考试系统要求
287,0,老师你好！录视频是不是要清唱？录视频一定是要一点杂音都没有吗，我家楼下还在施工。录视频是和考核老师实时视频还是考生提前录好？,专业一试是实时录像上传，建议选择安静的时间段
288,0,华南理工声乐系实时录制考试是否需要钢琴伴奏？,没有强制要求
289,0,1,无法参考
290,0,对着装有无要求?,对着装没有要求
291,0,找不到{学信网“艺术类招生作品远程提交系统”（https://bm.chsi.com.cn/）}???请问如何操作?找不到,系统尚未开放，请继续关注
292,0,您好，贵校于四月七日更新的招生简章我已阅读过，其中声乐表演的（学信网“艺术类招生作品远程提交系统”）目前是登不上去的，请问是通道尚未开发还是什么原因呢？以及准考证的打印和面试规则，是类似于现场直播的面试还是录制完毕了上传呢？对着装以及妆容方面有什么要求吗？谢谢,考试系统尚未开放。实时录像上传
293,0,我已经在平台报名，现在的状态是打印准考证，但是无法打印，系统提示联系志愿学校，请问什么时候可以打印准考证，谢谢,华南理工大学关于调整2020年艺术学院本科招生专业考试方案的通知http://admission.scut.edu.cn/2020/0331/c17699a370225/page.htm
294,0,请问贵校音乐表演类的曲目要求范围可以在哪里查到？,华南理工大学关于调整2020年艺术学院本科招生专业考试方案的通知http://admission.scut.edu.cn/2020/0331/c17699a370225/page.htm
295,0,请问音乐表演什么时候缴费？具体时间？,华南理工大学关于调整2020年艺术学院本科招生专业考试方案的通知http://admission.scut.edu.cn/2020/0331/c17699a370225/page.htm
296,0,请问贵校会否再次开启校考报名通道？谢谢,报名已经截止
297,0,建议贵校校考可推迟到高考后，网上考试和现场考试的确有一定的差别✔望采纳,建议已收到
298,0,网上缴费时间截止到4月8日，音乐表演方案还没出来，不知道对河南招不招琵琶专业，我们现在怎样缴费。,方案省招办审核中，招不招琵琶请见招生简章。华南理工大学2020年艺术学院本科招生简章http://admission.scut.edu.cn/2019/1228/c17747a360339/page.htm
299,0,请问贵校是在广州星海音乐学院设点招生考吗？何时开始报名呢？,在本校，报名已经结束
300,0,你好，我想了解一下广州考点音乐表演的考试形式是怎么样的,省招办审核中
301,0,该专业招收甘肃考生吗？分数线大约多少,我校没有该专业
302,0,贵校在广西招舞蹈专业为什么只招文科生而不是文理兼收？是基于什么考虑？对学理科的舞蹈生是否有失公平呢？,基于学校的有限的招生计划数和生源以及学校实际情况等多方面考虑
303,0,老师您好，近日有同学跟我们反馈说贵校的公布的设计类分数和录取原则不匹配，根据贵校的简章，广东采用的应该是省投档的规则，但是19年广东投给贵校的投档最低分是559，而贵校公布的官网公布的录取最低分缺失532分，投档分要比录取分还低，请问是分数或者规则有哪些调整吗？我这边是培训机构...[详细],未能满足专业志愿考生不服从专业调剂者退档。你可以查询当年志愿征集情况。
304,0,请问舞蹈学里包括体育舞蹈吗？,不包括。我校招收中国民族民间舞、古典舞
305,0,请问贵校广州考点考试时间怎么安排？,目前省招办正在审核中，请关注华南理工大学招生工作办公室官网：http://admission.scut.edu.cn/
306,0,请问今年在河南是否有古筝招生计划?若有，几个?是否承认省统考成绩?去年招生文化课最低线多少分?谢谢!,华南理工大学2020年艺术学院本科招生简章http://admission.scut.edu.cn/2019/1228/c17747a360339/page.htm华南理工大学2019年艺术类高考录取分数统计（持续更新）http://admission.scut.edu.cn/2019/0708/c17520a327241/page.htm
307,0,请问一下老师，招生简章还没审核完毕吗，我看老师发的艺术学院招生简章是19年12月发布的，想问一下大概什么时候招生简章可以审核完毕呢？,这个不确定
308,0,请问什么时候发布方案？？,目前省招办正在审核中，请关注华南理工大学招生工作办公室官网：http://admission.scut.edu.cn/。
309,0,老师您好，我想问一下贵校招内蒙古播音生或者音乐生吗？谢谢老师,暂时不招。华南理工大学2020年艺术学院本科招生简章http://admission.scut.edu.cn/2019/1228/c17747a360339/page.htm
310,0,未缴费的能不能修改曲目，真的恳求老师给一次机会修改一下曲目😭😭😭😭,不能了
311,0,没缴费可以修改曲目吗？真的跪求可以改一下，事情有变数,不能了
312,0,缴费之后还能修改曲目吗,不能
313,0,请问河北音乐类考生什么时候缴费,现在可以。按照教育部关于艺术类专业招生考试工作的文件精神，我校正在调整校考方案，目前省招办正在审核中，请关注华南理工大学招生工作办公室官网：http://admission.scut.edu.cn/。
314,0,老师好，在官网看到，贵校的舞蹈类和设计类的专业都采用统考录取了。还没有看到音乐类的相关细则。请问音乐类还没有确定是否采用校考还是统考吗？如果没有出细则，那么在缴费结束前是否应该出台具体规则？谢谢,按照教育部关于艺术类专业招生考试工作的文件精神，我校正在调整校考方案，目前省招办正在审核中，请关注华南理工大学招生工作办公室官网：http://admission.scut.edu.cn/。
315,0,请问贵校的艺术类的视觉传达设计、工业设计，环境设计等专业是否实行大类招生；或不是实行大类招生，进校后如果想换专业，贵校是否有改专业政策？,非大类招生，可咨询设计学院。华南理工大学2020年设计学专业（艺术类）招生简章http://admission.scut.edu.cn/2020/0331/c17699a370215/page.htm
316,0,学生就读设计学院艺术类环境设计专业或视觉传达专业，在大学期间，是否可以辅修建筑学专业？,我校建筑学院目前未开设辅修专业，更多学院培养情况可以咨询设计学院联系电话：020-39380729
317,0,你好，我是音乐表演专业考生。请问贵校的校考是否还接受报名？,报名已经结束
318,0,在特殊平台报名缴费成功以后，无法通过确认考试，系统提示联系学校，请问老师如何确认考试，谢谢,我校相关方案省招办正在审核中，请静候下一步安排
319,0,请问甘肃器乐的校考方案什么时候公布呢会取消吗采取线上考试还是推迟到高考结束后呢,省招办正在审核中，审核通过后我们会第一时间发布，请关注招生工作办公室http://admission.scut.edu.cn/
320,0,请问贵校在山西有招生计划吗？我是理科。,20年没有。华南理工大学2020年设计学专业（艺术类）招生简章http://admission.scut.edu.cn/2020/0331/c17699a370215/page.htm
321,0,请问贵校的艺术类环境设计开设了哪些具体课程,可以咨询华南理工大学设计学院http://www2.scut.edu.cn/design/  通讯地址 广州市番禺区大学城华南理工大学大学城校区设计学院B11栋 办公电话020-39380726（院办） 020-39380729（教务） 020-39380730（学工）
322,0,事情有变数，能不能修改曲目现在,已经不能修改
323,0,是可以缴费了吗,可以
324,0,您好，我已缴费成功，报名平台中的确认考试是什么意思呢？应该如何操作？谢谢,请关注我办网站及系统后续安排
325,0,老师您好，请问贵校初试的交费在哪里交呢,报名系统里面
326,0,请问贵校对美术类考生的文科成绩有没有单科分数限制，2020广东考生美术联考成绩250分，文科大概要考多少有机会录取你贵校，谢谢,往年没有单科分数限制，20年政策尚未发布。请关注招生工作办公室http://admission.scut.edu.cn/华南理工大学2019年艺术类高考录取分数统计（持续更新）http://admission.scut.edu.cn/2019/0708/c17520a327241/page.htm
327,0,你好，今天我已经缴费成功了，请问考试时间什么时候能确定,请关注招生工作办公室http://admission.scut.edu.cn/
328,0,高考延期了，是否会影响校考变动？（个人希望啊，希望还是在高考后进行现场考核）,请关注招生工作办公室http://admission.scut.edu.cn/
329,0,已经三月底了什么时候考试,请关注招生工作办公室http://admission.scut.edu.cn/
330,0,已经报名贵校的声乐校考，校考方案出来了吗？,请关注招生工作办公室http://admission.scut.edu.cn/
331,0,请问省外校考还可以在网上报名？在生源地参加了小三门统考合格，还须要再次考小三门吗？如果在读期间学的双排键电子琴电子钢琴可以改专业钢琴.钢琴伴奏吗？,报名已经结束
332,0,今天是三月底最后一天了，请问校考简章是今天出吗？哈哈哈,请关注招生工作办公室http://admission.scut.edu.cn/
333,0,老师好，请问贵校设计类专业就业主要面访哪些方面、行业、地域？就业率怎么样？再问一下学校设计类专业保研率大概多少，考研率怎么样？谢谢,今年政策尚未发布，你可以参考一下去年的华南理工大学2019年设计学专业（艺术类）招生简章http://admission.scut.edu.cn/2019/0604/c17747a321403/page.htm
334,0,什么时候出简章,请关注招生工作办公室http://admission.scut.edu.cn/
335,0,您好，请问缴费什么时候开始？具体的校考方案是怎样的？,近期开始，请密切关注招生工作办公室http://admission.scut.edu.cn/
336,0,贵校2020年有无辽宁省设计学类招生计划？,简章近期会发布，请关注招生工作办公室http://admission.scut.edu.cn/
337,0,古筝报名结束了么？,是的，民乐已经报名结束
338,0,请问贵校招圆号乐器不，文化课大概需要多少分，准备几时参加考试,华南理工大学2020年艺术学院本科招生简章http://admission.scut.edu.cn/2019/1228/c17747a360339/page.htm
339,0,用递交视频的方式不太能体现一个人的专业素质我真的很想考进贵校所以请慎重考虑初试的方式！,建议已收到
340,0,简章是今天出还是明天呀？😭😁😱😉😏😜😜😰😚😂😄😣😄😄😂😝👀,请关注华南理工大学招生工作办公室官网：http://admission.scut.edu.cn/
341,0,萨克斯专业，招收吗？录取方式？考试要求？考试时间？,报名已经结束了
342,0,什么时候发简章希望贵校可以在app内安排线上考,这几天
343,0,贵校2020年音乐类笙专业在甘肃有招生计划吗？器乐笙招收几个名额?甘肃省学生文化课成绩大概多少分可以？,民乐报名已经结束。华南理工大学2020年艺术学院本科招生简章http://admission.scut.edu.cn/2019/1228/c17747a360339/page.htm
344,0,三月底了啥时候出啊😭,近日
345,0,贵校招收民谣吉他专业的学生吗？,不招收
346,0,在A段还是B段录取,各省最终录取批次以考生生源地省级教育行政部门或招生考试机构公布为准。
347,0,你好，贵校在河南招收管乐演奏的考生吗？,河南的管乐校考已经结束。华南理工大学2020年艺术学院本科招生简章http://admission.scut.edu.cn/2019/1228/c17747a360339/page.htm
348,0,请问贵校招多少人,华南理工大学2020年艺术学院本科招生简章http://admission.scut.edu.cn/2019/1228/c17747a360339/page.htm
349,0,我是上海音乐学考生，贵校有在上海招生吗？有校考吗？不知是否错过报名时间！谢谢！,我校艺术类暂时不招收上海考生
350,0,有招福建美术生嘛？,今年政策尚未发布。近些年是没有的
351,0,贵校在兰州考点具体什么时间组织专业考试,按照教育部关于艺术类专业招生考试工作的文件精神，我校正在调整校考方案，拟于近日对考生发布，请关注华南理工大学招生工作办公室官网：http://admission.scut.edu.cn/。
352,0,老师，还在甘肃组织校考吗,按照教育部关于艺术类专业招生考试工作的文件精神，我校正在调整校考方案，拟于近日对考生发布，请关注华南理工大学招生工作办公室官网：http://admission.scut.edu.cn/。
353,0,贵校每年的招生指标各省都不一样请问湖南今年的音乐表演大概招收多少人分男女比例吗,我校将根据学科建设需要结合生源情况及考试情况调整各专业（招考方向）招生计划，并于专业考试后公布分省计划，港澳台考生不占招生计划。
354,0,说是校考报名时间31号就截止希望贵校尽快出相关方案提高文化课录取比例让联考一般的学生还能有劲冲刺文化课想报贵校两年了不想放弃,建议已收到
355,0,广西的2019专业投档成绩606是综合分606吗,注：按各省级招生考试机构的排序原则进行投档录取。其中，安徽、江西、湖北、广东、广西、重庆、四川、贵州按省级招生考试机构统一投档排序规则参与平行志愿投档录取。
356,0,请问贵校发布的2019艺术类高考广西最低分631是综合分631还是高考631...,注：按各省级招生考试机构的排序原则进行投档录取。其中，安徽、江西、湖北、广东、广西、重庆、四川、贵州按省级招生考试机构统一投档排序规则参与平行志愿投档录取。
357,0,如果本科考不上了考上了专科但是到时候还想考你们的学校请问你们学校的哪个专业允许专科生考专插本？,请咨询华南理工大学继续教育学院，招生：020-22236952、22236953；jxjyzsb@scut.edu.cn招生：020-22236952、22236953；jxjyzsb@scut.edu.cn20-22236952、22236953；jxjyzsb@scut.edu.cn招生：020-22236952、22236953；jxjyzsb@scut.edu.cn
358,0,三月底啥时候开始报名缴费啊，等的花儿都谢了😭,时间出来会第一时间发布
359,0,请贵校不要取消校考再三恳请请贵校再三考虑,建议已收到
360,0,您好，请问贵校今年在海南有招生计划吗？美术生有没招生计划？按什么方式招,政策尚未发布
361,0,不要取消校考！！接受任何形式的校考，不要采用统考成绩！！真的很喜欢华南理工……为了贵校很努力在准备校考，希望贵校慎重考虑！,建议已收到
362,0,请问报名时需要上传的资料里面，是上传统考合格证还是统考成绩证书？审核通过了是不是代表上传的是正确资料,初审通过说明材料符合要求
363,0,老师：您好，请问贵校美术专业对云招生吗？,今年政策尚未发布，2019年是没有的
364,0,老师，您好！贵校的“强基计划”招生简章什么时间发布？具体报名时间是？,还不确定
365,0,老师，您好，我已报名成功，但一直不能交费，怕错过交费时间，请问学校是安排几时交考费哩？谢谢,按照教育部关于艺术类专业招生考试工作的文件精神，我校正在调整校考方案，拟于3月底对考生发布，请关注华南理工大学招生工作办公室官网：http://admission.scut.edu.cn/。
366,0,老师您好！我想咨询一下贵校近三年在陕西录取美术及设计类各专业的文科生最低及平均分数，谢谢！,历年录取统计http://admission.scut.edu.cn/17520/list.htm
367,0,你好，请问广州考点是自己带伴奏还是钢伴？,按照教育部关于艺术类专业招生考试工作的文件精神，我校正在调整校考方案，拟于3月底对考生发布，请关注华南理工大学招生工作办公室官网：http://admission.scut.edu.cn/。
368,0,请问贵校校考对于二胡考生有何要求？,华南理工大学2020年艺术学院本科招生简章http://admission.scut.edu.cn/2019/1228/c17747a360339/page.htm
369,0,请问贵校校考招收甘肃省考生吗？对于考生的考试要求有哪些？,华南理工大学2020年艺术学院本科招生简章http://admission.scut.edu.cn/2019/1228/c17747a360339/page.htm
370,0,贵校是否举行校考？招收甘肃省考生吗？甘肃省考生的考试要求有哪些？,华南理工大学2020年艺术学院本科招生简章http://admission.scut.edu.cn/2019/1228/c17747a360339/page.htm
371,0,请问贵校校考报名截止时间是在什么时候？,按照教育部关于艺术类专业招生考试工作的文件精神，我校正在调整校考方案，拟于3月底对考生发布，请关注华南理工大学招生工作办公室官网：http://admission.scut.edu.cn/。
372,0,贵校校考报名截止时间是在什么时候？,按照教育部关于艺术类专业招生考试工作的文件精神，我校正在调整校考方案，拟于3月底对考生发布，请关注华南理工大学招生工作办公室官网：http://admission.scut.edu.cn/。
373,0,贵校在甘肃省的校考是否取消？,按照教育部关于艺术类专业招生考试工作的文件精神，我校正在调整校考方案，拟于3月底对考生发布，请关注华南理工大学招生工作办公室官网：http://admission.scut.edu.cn/。
374,0,您好！若取消校考，建议采取综合分录取，因为失去了校考的机会，更多的考生会在文化上多做努力，请给我们多一些机会！谢谢,建议已经收到
375,0,你好，我想问下广州考点音乐表演什么时候报名交费,报名已经截止，交费还未开始
376,0,老师您好，请问贵校今年会在河南招收编导生吗？如果是，请问是按照校考成绩还是统考成绩呢，去年的分数线分数段和招生人数是多少,我校没有编导专业
377,0,请问贵校2020年设计专业（艺术类）有港澳台招生政策吗？,暂时没有
378,0,之前没有报名，请问现在湖南省器乐类的还能报名吗？可否延长报名时间呜呜呜,报名已经截止
379,0,对于来自甘肃省的舞蹈专业录取标准是什么？是按专业排名，还是按专业和文化成绩占比录取？,今年政策尚未发布，提供去年相关信息供参考：1.关于公布2019年艺术学院本科招生舞蹈学专业分省计划及录取原则的通知http://admission.scut.edu.cn/2019/0613/c17747a325257/page.htm2.华南理工大学2019年艺术类高考录取分数统计（持续更新）http://admission.scut.edu.cn/2019/0708/c17520a3...[详细]
380,0,大概什么时候缴费打印准考证，什么时候初试呢？初试跟复试的时间会隔多久呢？往年钢琴表演的分数线是多少呢，,按照教育部关于艺术类专业招生考试工作的文件精神，我校正在调整校考方案，拟于3月底对考生发布，请关注华南理工大学招生工作办公室官网：http://admission.scut.edu.cn/。华南理工大学2020年艺术学院本科招生简章http://admission.scut.edu.cn/2019/1228/c17747a360339/page.htm华南理工大学...[详细]
381,0,老师你好，今年山东设计类还招生吗？如果招生简章大约什么时候出？，谢谢老师！,政策尚未发布，请关注我办官方网站http://admission.scut.edu.cn/或者微信公众号
382,0,请问今年20年广东省舞蹈学分省计划大概是多少人？或广东省计划战百分之几？谢谢！,政策尚未发布，请关注我办官方网站http://admission.scut.edu.cn/或者微信公众号
383,0,音乐表演（声乐）广东考生还需要考乐理视唱练耳吗,不需要
384,0,老师您好，请问广州考点的缴费结束了吗，还是没有开始,还没有开始，请关注我办官方网站或者微信公众号
385,0,请问贵校今年一月份在江西组织的音乐表演招生校考是否有效？,有效
386,0,请问老师2020年在河北美术是在A段还是B段招生？,20年政策尚未发布，19年我校未在河北招收美术专业生
387,0,请问甘肃省的考生报考还考视唱练耳乐理吗？,不用
388,0,请问怎么判定其他省统考视唱练耳乐理是否合格呢？,华南理工大学2020年艺术学院本科招生简章http://admission.scut.edu.cn/2019/1228/c17747a360339/page.htm
389,0,请问湖南省的报考的考生还需要考视唱练耳乐理吗？,不需要
390,0,疫情前报考系统报名不了现在还可以报名吗,广州考点报名已经结束。我校广州考点自2020年1月15日08:00在阳光高考特殊类型招生报名平台（https://gaokao.chsi.com.cn/zzbm/yslbm/）开始报名，期间系统一直正常运行，不存在报不了名单情况。
391,0,您好！河南美术专业（理科）招生简章是?,尚未发布
392,0,西洋管弦乐合格证发放比例,1：4以内
393,0,天津重点中学考生，通过天津舞蹈类统一考试，文化课成绩优异，是否可以报考？文化课和专业课权重比例如何？,根据《华南理工大学2020年艺术学院本科招生简章》我校舞蹈学专业2020年招生范围：河北、山西、江西、河南、湖北、湖南、广东、广西、海南、重庆、四川、陕西、甘肃。暂不招收天津考生
394,0,希望该校一定一定一定要举行校考，千万不要取消校考，让联考考的不理想的多次机会🙏🙏🙏🙏拜托了,按照教育部关于艺术类专业招生考试工作的文件精神，我校正在调整校考方案，拟于3月底对考生发布，请关注华南理工大学招生工作办公室官网：http://admission.scut.edu.cn/。
395,0,很抱歉打扰问一下，请问贵校的老师，是视唱练耳乐理在省联考合格之后，贵校还专门组织考试考吗？因为今年疫情原因，不可能视唱练耳乐理也线上考试吧，那样太不公平，如果考的话请安排线下，不考的话可以看考生联考合格成绩标志，谢谢啦！,华南理工大学2020年艺术学院本科招生简章http://admission.scut.edu.cn/2019/1228/c17747a360339/page.htm
396,0,您好，我之前在招生网上看见，音乐学理论这项课程只在广东招考。想请问一下，其他省份的考生可否去报考音乐学理论专业，现在还可以报考吗？,招生省份的考生都可以报考。但是2020年报名已经截止了
397,0,请问下该贵校音乐表演各种乐器的招生人数是多少个呢会每种乐器在全国来招就只招1-2个吗？（例如长笛）还是广东省会多招一些呢,不分乐器 我校音乐类专业计划采用文理综合编制的原则，不区分考生文理科类。考生在取得省专业统考合格证书（高考所在省份未组织统一考试除外）、文化考试成绩达到高考所在省艺术类同批次录取最低控制分数线的基础之上，符合录取条件者，按照如下办法予以录取：（1）音乐表演专业分为音乐表演（声乐演唱）、音乐表演（器乐演奏）...[详细]
398,0,我是甘肃省兰州市第十四中学,按照教育部关于艺术类专业招生考试工作的文件精神，我校正在调整校考方案，拟于3月底对考生发布，请关注华南理工大学招生工作办公室官网：http://admission.scut.edu.cn/。
399,0,我是甘肃省兰州市第十四中学的,按照教育部关于艺术类专业招生考试工作的文件精神，我校正在调整校考方案，拟于3月底对考生发布，请关注华南理工大学招生工作办公室官网：http://admission.scut.edu.cn/。
400,0,您好，贵校今年河北省有招生计划吗，音乐学丶音乐教育、音乐表演长笛河北招几人，建议多少分填志愿,华南理工大学2020年艺术学院本科招生简章http://admission.scut.edu.cn/2019/1228/c17747a360339/page.htm
401,0,其他市统考合格会不会考视唱乐理练耳,不会
