ID,标签,问题,答案324,0,你好，我是广东省文科美术生，请问贵校文化控制线是按普通生还是艺术生设置？有没有单科成绩要求？招不招日语考生？是按综合分数录取吗？综合分数的计算方法是什么？,你好，我是广东省文科美术生，请问贵校文化控制线是按普通生还是艺术生设置？按照广东省艺术类分数线有没有单科成绩要求？学校不另外设置单科要求招不招日语考生？不限考生语种，但是本校公共外语教学为英语，请非英语语种考生慎重报考。是按综合分数录取吗？综合分数的计算方法是什么？我校...[详细]
325,0,您好，贵校今年河北省有招生计划吗，音乐学丶音乐教育、音乐表演长笛河北招几人，建议多少分填志愿,你好，根据《教育部教学司关于做好2020年普通高校特殊类型招生工作的通知》（教学厅【2019】10号）文件精神，结合我校招生及人才培养工作的实际，我校自2020年起不再组织音乐与舞蹈学（含音乐学、音乐表演、舞蹈学三个专业）和美术学与设计学类（含美术学、视觉传达设计、环境设计、产品设计...[详细]
326,0,请问贵校环景设计专业有研究生部吗？或者本科毕业后可以考贵校哪些专业的研究生？就业情况如何？谢谢！,我校美术学院有研究生，具体可参考http://statics.scnu.edu.cn/pics/zsb/2019/0621/1561084661102437.pdf
327,0,招小提琴艺术生吗？需要校考吗？,你好，根据《教育部教学司关于做好2020年普通高校特殊类型招生工作的通知》（教学厅【2019】10号）文件精神，结合我校招生及人才培养工作的实际，我校自2020年起不再组织音乐与舞蹈学（含音乐学、音乐表演、舞蹈学三个专业）和美术学与设计学类（含美术学、视觉传达设计、环境设计、产品设计...[详细]
328,0,请问贵校会招湖南琵琶生吗,你好，根据《教育部教学司关于做好2020年普通高校特殊类型招生工作的通知》（教学厅【2019】10号）文件精神，结合我校招生及人才培养工作的实际，我校自2020年起不再组织音乐与舞蹈学（含音乐学、音乐表演、舞蹈学三个专业）和美术学与设计学类（含美术学、视觉传达设计、环境设计、产品设计...[详细]
329,0,老师好，请问贵校的“美术学（师范）”专业，毕业后是可以当美术老师吗？是不是还要考取“美术类的教师资格证”呢？,同学您好，美术学专业可以选择毕业后当老师。现在国家要求所有中小学教师都要有教师资格证，所以美术学专业的学生如果想当老师也要先考取教师资格证
330,0,大概是在什么时候出简章,你好，根据《教育部教学司关于做好2020年普通高校特殊类型招生工作的通知》（教学厅【2019】10号）文件精神，结合我校招生及人才培养工作的实际，我校自2020年起不再组织音乐与舞蹈学（含音乐学、音乐表演、舞蹈学三个专业）和美术学与设计学类（含美术学、视觉传达设计、环境设计、产品设计...[详细]
331,0,在年前没发布有关不组织音乐校考外省考生觉得挺突然的因为我是在广州集训的就是奔着华师去的希望不负集训时光贵校在招生计划时是会对各省各专业都涉及到嘛还是选择性招某个省的某个专业,是的，我校美术类是2019年就采用联考术科成绩招生了，音乐今年也是不组织校考，直接使用考生所在省份提供的统考成绩作为考生的专业考试成绩。具体录取方法和哪些省哪些专业招生等信息还未确定，确定后我校将在我校招考处官网发布。
332,0,今年计划招山西古筝专业的学生吗？有多少名额，文化和专业大概需要多少分？需要校考吗,你好，根据《教育部教学司关于做好2020年普通高校特殊类型招生工作的通知》（教学厅【2019】10号）文件精神，结合我校招生及人才培养工作的实际，我校自2020年起不再组织音乐与舞蹈学（含音乐学、音乐表演、舞蹈学三个专业）和美术学与设计学类（含美术学、视觉传达设计、环境设计、产品设计...[详细]
333,0,贵校钢琴专业是否在河北招生,你好，我校我校自2020年起不再组织音乐与舞蹈学（含音乐学、音乐表演、舞蹈学三个专业）和本科招生校考，直接使用考生所在省份提供的统考成绩作为考生的专业考试成绩。具体招生办法、分省分专业招生计划、录取办法还未确定，确定后将在我校官网另行发布这些信息。
334,0,专业统考233分，文化多少分可以上贵校？有文理分省计划吗？,你好，我校今年美术类采用考生所在省份提供的统考成绩作为考生的专业考试成绩，美术类外省只收文科生。但是因为我校的招生录取办法还未确定，所以暂时无法估计录取分数。
335,0,请问贵校今年在甘肃有招生计划吗，如果有，招多少学生,你好，具体专业招生办法、分省招生计划、录取规则还未确定，确定后我校将在官网发布这些信息。
336,0,招小提琴艺术生吗需要校考吗？,你好，我校我校自2020年起不再组织音乐与舞蹈学（含音乐学、音乐表演、舞蹈学三个专业）和本科招生校考，直接使用考生所在省份提供的统考成绩作为考生的专业考试成绩。具体招生办法、分省分专业招生计划、录取办法这些信息我校将另行发布。
337,0,贵校今年是否在甘肃有音乐表演（声乐）招生计划,你好，我校我校自2020年起不再组织音乐与舞蹈学（含音乐学、音乐表演、舞蹈学三个专业）和本科招生校考，直接使用考生所在省份提供的统考成绩作为考生的专业考试成绩。具体招生办法、分省分专业招生计划、录取办法现在还未确定，确定后我校将另行发布。
338,0,统考如何录取,你好，统考的具体招生办法、分省分专业招生计划、录取办法还未确定，确定后将在我校官网另行发布这些信息。
339,0,是按综合分录取吗？,你好，我校我校自2020年起不再组织音乐与舞蹈学（含音乐学、音乐表演、舞蹈学三个专业）和本科招生校考，直接使用考生所在省份提供的统考成绩作为考生的专业考试成绩。具体招生办法、分省分专业招生计划、录取办法还未确定，确定后将在我校官网另行发布这些信息。
340,0,今年贵校的艺术校考是取消了，用联考与高考的综合分考取了吗？,我校自2020年起不再组织音乐与舞蹈学（含音乐学、音乐表演、舞蹈学三个专业）和美术学与设计学类（含美术学、视觉传达设计、环境设计、产品设计、数字媒体艺术五个专业）本科招生校考，直接使用考生所在省份提供的统考成绩作为考生的专业考试成绩。具体招生办法、分省分专业招生计划、录取办...[详细]
341,0,请问华南师范艺术舞蹈专业还可以报名吗？,我校自2020年起不再组织音乐与舞蹈学（含音乐学、音乐表演、舞蹈学三个专业）和美术学与设计学类（含美术学、视觉传达设计、环境设计、产品设计、数字媒体艺术五个专业）本科招生校考，直接使用考生所在省份提供的统考成绩作为考生的专业考试成绩。具体招生办法、分省分专业招生计划、录取办...[详细]
342,0,今年怎么还没出招生简章？会承认湖南音乐的统考成绩吗？,我校自2020年起不再组织音乐与舞蹈学（含音乐学、音乐表演、舞蹈学三个专业）和美术学与设计学类（含美术学、视觉传达设计、环境设计、产品设计、数字媒体艺术五个专业）本科招生校考，直接使用考生所在省份提供的统考成绩作为考生的专业考试成绩。具体招生办法、分省分专业招生计划、录取办...[详细]
343,0,今年的舞蹈类招生计划如何？,目前专业计划还没定。艺术类具体招生办法、分省分专业招生计划、录取办法等信息我校将另行发布。
344,0,您好，我想问一下今年河南美术生的，招生名额，和录取原则，谢谢,我校自2020年起不再组织音乐与舞蹈学（含音乐学、音乐表演、舞蹈学三个专业）和美术学与设计学类（含美术学、视觉传达设计、环境设计、产品设计、数字媒体艺术五个专业）本科招生校考，直接使用考生所在省份提供的统考成绩作为考生的专业考试成绩。具体招生办法、分省分专业招生计划、录取办...[详细]
345,0,请问一下关于湖南美术专业生未过联考线，还有机会考本院校吗？如果可以的话按照往年录取分数线来说，今天文化分数线大概是多少。麻烦老师解说一下,你好，我校今年湖南美术采用联考招生，具体分省分专业招生计划、录取办法未定，届时将另行发布。因为今年和往年录取方式不同。所以没有参考数据。如果美术成绩未过联考线，应该考我校机会不大。
346,0,请问贵校的艺术类招生今年是否举行校考？,我校自2020年起不再组织音乐与舞蹈学（含音乐学、音乐表演、舞蹈学三个专业）和美术学与设计学类（含美术学、视觉传达设计、环境设计、产品设计、数字媒体艺术五个专业）本科招生校考，直接使用考生所在省份提供的统考成绩作为考生的专业考试成绩。具体招生办法、分省分专业招生计划、录取办...[详细]
347,0,请问音乐类校考什么时候进行,我校自2020年起不再组织音乐与舞蹈学（含音乐学、音乐表演、舞蹈学三个专业）和美术学与设计学类（含美术学、视觉传达设计、环境设计、产品设计、数字媒体艺术五个专业）本科招生校考，直接使用考生所在省份提供的统考成绩作为考生的专业考试成绩。具体招生办法、分省分专业招生计划、录取办...[详细]
348,0,老师您好，我想报考学校美术类专业，咨询学校往年综合分分数对文化课是否有小圈限制。谢谢老师,按照考生所在省规定，我校没有没有另外的小分限制
349,0,一直没找到你们的报名窗口,我校艺术类在外省一直是只招文科考生。
350,0,舞蹈学专业是否组织校考？何种形式？如果联考河北在哪段招生？,我校自2020年起不再组织音乐与舞蹈学（含音乐学、音乐表演、舞蹈学三个专业）和美术学与设计学类（含美术学、视觉传达设计、环境设计、产品设计、数字媒体艺术五个专业）本科招生校考，直接使用考生所在省份提供的统考成绩作为考生的专业考试成绩。具体招生办法、分省分专业招生计划、录取办...[详细]
351,0,有没有舞蹈专业，开放报名吗？文化课估计需要多少分,我校自2020年起不再组织音乐与舞蹈学（含音乐学、音乐表演、舞蹈学三个专业）和美术学与设计学类（含美术学、视觉传达设计、环境设计、产品设计、数字媒体艺术五个专业）本科招生校考，直接使用考生所在省份提供的统考成绩作为考生的专业考试成绩。具体招生办法、分省分专业招生计划、录取办...[详细]
352,0,你好，我找了很久没找到华南师范大学的招生简章，请问出了音乐类的招生简章嘛？,我校自2020年起不再组织音乐与舞蹈学（含音乐学、音乐表演、舞蹈学三个专业）和美术学与设计学类（含美术学、视觉传达设计、环境设计、产品设计、数字媒体艺术五个专业）本科招生校考，直接使用考生所在省份提供的统考成绩作为考生的专业考试成绩。具体招生办法、分省分专业招生计划、录取办...[详细]
353,0,外省还会有音乐类校考吗,我校自2020年起不再组织音乐与舞蹈学（含音乐学、音乐表演、舞蹈学三个专业）和美术学与设计学类（含美术学、视觉传达设计、环境设计、产品设计、数字媒体艺术五个专业）本科招生校考，直接使用考生所在省份提供的统考成绩作为考生的专业考试成绩。具体招生办法、分省分专业招生计划、录取办...[详细]
354,0,请问贵校今年表演专业校考取消，还有表演专业吗？如果有，怎么从统考成绩录取？看综合分排名？还是看要报考的专业单科成绩排名？,还有表演专业。具体专业招生办法、分省分专业计划、录取办法等信息还在讨论，到时我校将另行发布。
355,0,老师你好，我特别想问今年的华南师范大学音乐学院还会举行校考么？还是因为疫情全部转入省联考招生，今年对福建省的招生计划有变么？这两天看到中央戏剧学院和北京舞蹈学校等艺术类院校都按高考文化高低录取，我为了报考华南师范大学练了很久的专业，请问会如同其他院校一样按高考文化分录取...[详细],我校自2020年起不再组织音乐与舞蹈学（含音乐学、音乐表演、舞蹈学三个专业）和美术学与设计学类（含美术学、视觉传达设计、环境设计、产品设计、数字媒体艺术五个专业）本科招生校考，直接使用考生所在省份提供的统考成绩作为考生的专业考试成绩。具体招生办法、分省分专业招生计划、录取办...[详细]
356,0,请问今年音乐教育招生吗？招多少？综合分大概要求多少分？谢谢！,音乐学专业今年有招生。具体招生计划还在讨论，届时将在我校官网另行通知分数要求可参考我校去年录取情况：音乐学2019年广东省我校最低录取分数为投档总分549分（全省第121名）
357,0,我想问一下，什么时候出招生简章呢？还会组织校考吗？,我校自2020年起不再组织音乐与舞蹈学（含音乐学、音乐表演、舞蹈学三个专业）和美术学与设计学类（含美术学、视觉传达设计、环境设计、产品设计、数字媒体艺术五个专业）本科招生校考，直接使用考生所在省份提供的统考成绩作为考生的专业考试成绩。具体招生办法、分省分专业招生计划、录取办...[详细]
358,0,老师您好，我是来自广西的2020年音乐艺考生。我想请问一下，华南师范大学2020年艺术类招生是还未开始吗，招生简章还未颁布吗？,我校自2020年起不再组织音乐与舞蹈学（含音乐学、音乐表演、舞蹈学三个专业）和美术学与设计学类（含美术学、视觉传达设计、环境设计、产品设计、数字媒体艺术五个专业）本科招生校考，直接使用考生所在省份提供的统考成绩作为考生的专业考试成绩。具体招生办法、分省分专业招生计划、录取办...[详细]
359,0,您好！请问贵校的音乐表演的古筝专业今年还召生吗？今年还没有看到相关简章，希望贵校不要取消校考，要知道联考的标准和校考是不样的，我们一直在准备，就是为了冲刺贵校的校考专业。如果初试以视频及远程的方式，都能给我们一个机会，不管结局如何，今年疫情影响，很多学校要高考后复试，对...[详细],我校自2020年起不再组织音乐与舞蹈学（含音乐学、音乐表演、舞蹈学三个专业）和美术学与设计学类（含美术学、视觉传达设计、环境设计、产品设计、数字媒体艺术五个专业）本科招生校考，直接使用考生所在省份提供的统考成绩作为考生的专业考试成绩。具体招生办法、分省分专业招生计划、录取办...[详细]
360,0,老师您好，我家孩子2019年山西理科高考535分，省排名区间19182-19585，想咨询下一批报考贵校能被录取嘛？,我校历年录取情况请参考https://zsb.scnu.edu.cn/zhiyuancankao/
361,0,请问华南师范的一批提档率是105%吗，提档服从调剂会退档吗？,根据生源情况确定投档比例，投档比例原则上控制在招生计划的100%-120%以内，学校视生源情况适当调整。在实行平行志愿投档的省（自治区、直辖市），学校可根据各省级招办公布的平行志愿投档规则及生源情况确定招生计划微调方案和调档比例。平行志愿身体符合录取条件和服从调剂的情况下不退档
362,0,您好，我想报师范生，但面部下颌有红色胎记，可以报吗？非常感谢！,我校录取考生的体检标准按照教育部、卫生部、中国残疾人联合会颁布的《普通高等学校招生体检工作指导意见》（教学〔2003〕3号）和《教育部办公厅卫生部办公厅关于普通高等学校招生学生入学身体检查取消乙肝项目检测有关问题的通知》（教学厅〔2010〕2号）的有关规定执行。
363,0,请问一批的调档率是105%吗，如果服从调剂会不会退档？,平行志愿服从调剂不退档
364,0,请问贵校的中外合作办专业是否取得办学审批？,符合教育部办学要求
365,0,我没有报师范类专业，如果服从志愿调剂会被调剂到师范类专业吗？,在同批次同科类有录取计划的专业里面调剂
366,0,请问，广东文科生527，排位在33585报考贵校的提前批教师专项计划有机会被录取吗？被提档后没被录取会不会影响本科批次的录取？,不会影响本科批次的录取我校历年录取情况请参考https://zsb.scnu.edu.cn/zhiyuancankao/
367,0,如果音乐学的投档比例为120%，比录取人数多出来的档案会被退回吗,如果是统考平行志愿不退档校考的话按照我校录取原则录取
368,0,辽宁文科位次2168，请问可以报考贵校吗？,我校历年录取情况请参考https://zsb.scnu.edu.cn/zhiyuancankao/
369,0,新疆文科省排860-880报考贵校希望大吗？谢谢老师,我校历年录取情况请参考https://zsb.scnu.edu.cn/zhiyuancankao/
370,0,高考分数为342，在所报科类内排名第58494。是否可以报考贵校专科。,我校普通高考没有专科
371,0,你好，请问贵校在福建的录取位次大概在多少,我校历年录取情况请参考https://zsb.scnu.edu.cn/zhiyuancankao/
372,0,请问心理学（师范）是什么意思呢，这个专业是主要学习教育心理学吗，还是毕业后要定向从事师范类的工作，可不可以读研呢？谢谢老师,专业介绍请参考https://zsb.scnu.edu.cn/zyjj/
373,0,重庆文科考生位次2594有希望就读贵校汉语言专业吗？或者历史师范专业呢？,我校历年录取情况请参考https://zsb.scnu.edu.cn/zhiyuancankao/
374,0,老师请问若报名非师范类专业在学校还可以转入师范类专业吗专业不同呢,我校新生（除艺术类、高水平运动队、运动训练、单独院校代码招生中外合作专业等特殊类外）入学后第二学期，可按自己的兴趣爱好“零门槛”申请专业转出，经考核同意后在第三学期转入新专业学习。
375,0,您好，河南考生文科592分，位次2999，能报考贵校吗,我校历年录取情况请参考https://zsb.scnu.edu.cn/zhiyuancankao/
376,0,请问院校代码与专业代码在哪里查询？我想获取师范类专业的专业代码,我校学校代码是10574具体专业代码请参考各省发的专业目录
377,0,如题,平行志愿的话服从调剂和体检合格的情况下不退档
378,0,请问我文科9900名，依靠地方专项可以上贵校的汉语言专业吗？,我校历年录取情况请参考https://zsb.scnu.edu.cn/zhiyuancankao/
379,0,您好，我是广东文科考生，573分，排位7909。请问今年贵校的预估投档线是多少，我有希望冲进去吗？谢谢,我校历年录取情况请参考https://zsb.scnu.edu.cn/zhiyuancankao/
380,0,请问吉林地区578全省1267考进华南师范大学成功几率大吗,我校近五年吉林文科录取情况：2018年最低录取分561，比分数线高19分；2017年一本线528，最低录取分555，比一本线高27分；2016年一本线531，最低录取分549，比一本线高18分；2015年一本线543，最低录取分571，比一本线高28分；2014年一本线560，最低录取分582，比一本线高22分。我校近五年吉林...[详细]
381,0,请问报考师范类提前批，毕业后是定向分配还是自主就业？另外，师范类提前批与教师专项是否相同？,我校普通类师范生毕业是自主就业广东省的教师专项是定向分配
382,0,请问报考贵校普通本科一批，能辅修其他学位或修双学位吗？提前批师范类呢？,辅修专业请咨询我校教务处020-85211092
383,0,华师2019年的师范类专业不在提前批录取？,广东省师范类在提前批录取其他省份看各省招生办安排
384,0,请问华师今年中国语言文学专业是否招收理科生？总分553排位27435是否有机会被录取？作文方面获得国家级奖项是否有帮助？,我校历年录取分数请参考https://zsb.scnu.edu.cn/zhiyuancankao/
385,0,老师您好，我是一名云南考生。请问一下在贵校投档的总分包括少数民族政策性照顾分吗？,有关加分或照顾录取政策，在各省份执行各省招生办公布的加分项目及分值。加分分值适用于投档及专业分档。
386,0,您好，我是陕西理科考生，今年高考分数为588分，排名10295，请问报考贵校网络工程专业，有希望被录取吗？谢谢！,我校历年录取情况请参考https://zsb.scnu.edu.cn/zhiyuancankao/
387,0,请问贵校汉语言文学师范与非师范的区别？谢谢！,师范与非师范专业主要在课程设置上有所区别，师范专业是以培养优秀教师为主要目的，在课程设置上会侧重于教师技能的培养。入学后的第二学期，学生可根据自己的兴趣爱好，在师范与非师范各专业申请互转，这样填报志愿可增加录取的机会。
388,0,请问老师，贵校官网上面有提到心理学基地班在新生里选拔，请问需要什么条件？入学以后如果在大一申请辅修第二专业，是否也需要推迟毕业？谢谢！,心理学基地班请咨询心理学院辅修请咨询教务处020-85211092
389,0,请问贵校的提前批什么时候可以填志愿？,我校在第二阶段报考：第二时段：6月26日21:00－7月2日18:00。本时段除提前批需政审(政治考核)、面试、体检的军队、武警、公安、司法、消防以及招收飞行技术专业等院校以外，其他所有各批次、各科类（普通文理科、艺术、体育等）院校志愿均需在本时段填报并进行网上确认志愿信息。
390,0,老师你好，您校今年在湖北的招生计划专业要么是管理类，要么是师范类。我想去贵校学习其他非师范的专业，请问是放弃填报（专业不符）还是进校后给我们转大类的机会？,我校新生（除艺术类、高水平运动队、运动训练、单独院校代码招生中外合作专业等特殊类外）入学后第二学期，可按自己的兴趣爱好“零门槛”申请专业转出，经考核同意后在第三学期转入新专业学习。
391,0,2019提前批可以报考哪些专业,我校招生计划请参考https://zsb.scnu.edu.cn/a/20190614/388.html我校历年录取情况请参考https://zsb.scnu.edu.cn/zhiyuancankao/
392,0,老师您好，我是今年陕西文科考生602分省排名1615名，能报应用心理学专业吗?,我校历年录取情况请参考https://zsb.scnu.edu.cn/zhiyuancankao/
393,0,您好！山东理科考生605分位次13749名报考贵校有希望吗？请问如请果选择服从调剂那么会出现过提档线而退档的情况吗？,平行志愿如果服从调剂且身体符合录取条件不会退档
394,0,贵校提档后有退档的可能吗？有没有预留学位？,平行志愿的情况下，如果服从调剂和身体符合录取条件不会退档
395,0,请问提前批师范类填报时间是什么,我们学校在广东省的报考时间在第二阶段：第二时段：6月26日21:00－7月2日18:00。本时段除提前批需政审(政治考核)、面试、体检的军队、武警、公安、司法、消防以及招收飞行技术专业等院校以外，其他所有各批次、各科类（普通文理科、艺术、体育等）院校志愿均需在本时段填报并进行网上确认志愿...[详细]
396,0,您好我现在贵州理科9500名左右请问贵校的投档是105%吗？若是如果服从调剂的话是不是不会被退档谢谢,平行批次服从调剂不退档
397,0,您好，我是高2016级四川文科考生，我的高考成绩是548分，有意愿填报贵校，请问有没有可能被录取？,我校历年录取分数请参考https://zsb.scnu.edu.cn/zhiyuancankao/
398,0,1、师范专业可辅修非师范专业如金融学、会计学等？2、辅修获得足够学分可取得辅修专业的本科学士学位？3、若本科期间无辅修非师范专业如金融，本科以师范毕业后可直接考取金融研究生？感谢回复！！,辅修专业请咨询我校教务处020-85211092
399,0,老师您好:我是新疆理科考生，成绩556，位次4140，报考贵校有希望吗，如果服从调剂是否会退档，谢谢！,我校历年录取分数请参考https://zsb.scnu.edu.cn/zhiyuancankao/
400,0,我的成绩为597，能否通过国家专项计划报考贵校心理学专业，位次为17549,我校没有国家专项的心理学专业计划
