ID,标签,问题,答案128,0,请问关于学业水平考试要求由各省招生机构公布是什么意思这个在哪能找到谢谢,咨询省招办
129,0,老师您好！我是河南理工科考生，志愿实行平行招生，如果各个方面都符合条件，专业同意调剂，投档后退档吗？敬盼回复！老师您辛苦了！,平行志愿批次普通类考生出档后，服从调剂且符合专业录取要求者不退档。
130,0,您好，本人广东文科排名2150。请问是否有希望被贵校法学院录取？,http://admission.scut.edu.cn/2019/0718/c17520a328738/page.htm
131,0,您好，本人广东省文科排名2150。请问是否有机会被贵校法学院（知识产权学院）录取？卓越法律班呢？,http://admission.scut.edu.cn/2020/0529/c17520a379341/page.htm参照去年分数排位，注意拉开梯度
132,0,甘肃省理科生，583分，报贵校贫困地区国家专项计划有希望录取吗？会退档吗？,http://admission.scut.edu.cn/2020/0529/c17520a379341/page.htm参照去年分数排位，注意拉开梯度
133,0,强基计划生跟一般高考生比起来到底有多少好处呢？因为我本身也能上华理的数学，不知道有什么区别,华南理工大学强基计划招生问答http://admission.scut.edu.cn/2020/0511/c17748a376042/page.htm华南理工大学2020年强基计划招生简章http://admission.scut.edu.cn/2020/0506/c17748a375662/page.htm
134,0,请问老师贵校计算机科学与技术专业采用的是全英教学吗？是个例还是普遍？,如全英班就是
135,0,贵校今年在甘肃设有预科班吗,华南理工大学2020年少数民族预科班招生计划表http://admission.scut.edu.cn/2020/0701/c17543a388702/page.htm
136,0,华南理工大学综合评价招生什么时候报志愿，在哪填报？,广东省招生委员会办公室关于做好2020年普通高校招生填报志愿工作的通知 广东省教育考试院http://eea.gd.gov.cn/ptgk/content/post_3050901.html
137,0,辽宁3000名报考有没有希望？如果提档了会退档吗？转专业这一块有什么限制,http://admission.scut.edu.cn/2020/0529/c17520a379341/page.htm参照去年分数排位，注意拉开梯度
138,0,老师您好，黑龙江省美术生，综合分499.3，今年想报考贵校有希望么？贵校第一年在黑龙江招生，没有任何参考，看招生简章没有专门介绍艺术生录取原则的，想问录取要求是什么呢？谢谢您回答，谢谢老师！😀,华南理工大学2019年艺术类高考录取分数统计http://admission.scut.edu.cn/2019/0708/c17520a327241/page.htm华南理工大学2020年设计学专业（艺术类）招生简章http://admission.scut.edu.cn/2020/0331/c17747a370215/page.htm三、录取原则1.高考文化课成绩和专业成绩均需达到省级招生考试机构划定的我校艺术类...[详细]
139,0,一、贵校今年在广东省扩招吗？二、卓越班，创新班之类的班级，分配进去的考生都是成绩排前的吗？,略有上涨高考择优录取
140,0,如果没有填最不想去的专业，有可能被调剂到医学专业吗？,我校医学类专业分数较高，未出现调剂
141,0,我是宁夏的考生，有些问题想咨询一下，有在宁夏负责招生老师的联系方式吗,020-87110737
142,0,强基计划显示审核通过是什么意思，可以去校考了吗,2020年强基计划面试入围标准公示及面试基本安排http://admission.scut.edu.cn/2020/0726/c17748a390618/page.htm
143,0,我是文科学生，排位是广东省1776名。想报的专业是法学。考虑到今年法学的热度有所上升，我担心这个排位报法学录取率是不是比较低,http://admission.scut.edu.cn/2019/0718/c17520a328738/page.htm
144,0,老师，四川理科560分，上貴校的少数民族预科班有多少可能性？去年录取分数是多少？一年后分专业时有无限制？,http://admission.scut.edu.cn/2020/0523/c17520a378738/page.htm专业录取时已定
145,0,我广东文科考生，607分1128排位，想去贵校的经济类创新班或工商管理专业，是否可行。,http://admission.scut.edu.cn/2020/0529/c17520a379341/page.htm参照去年分数排位，注意拉开梯度
146,0,国家专项和高校专项去年的最低分数多少，今年河南645分同意调剂专业录取概率分别是多少，谢谢,http://admission.scut.edu.cn/2020/0523/c17520a378738/page.htm
147,0,经济学创新班本硕连读，是几年学制？另外，如果录到这个专业，不想读在硕士，四年可以毕业么？可以推免到其它高校读硕士么,本硕贯通培养，学制6年，因培养学制只能保研本校，中途退出回到平行班毕业。
148,0,老师，我是河北省一考生，考了664分，省3435名，能上贵校吗，可以报考的比较热门专业有什么,http://admission.scut.edu.cn/2020/0523/c17520a378731/page.htm分数不错，建议报考，可以考虑中段附近专业
149,0,学校强基计划面试名单什么时候公布？还是通知到个人？,注意关注我校招生办网站http://admission.scut.edu.cn/main.htm
150,0,老师你好：2019年黑龙江地区国家专项贫困县的录取情况，物理学类分数线,国家专项录取最低分606
151,0,贵校2020年在江西是否有提前批本科非军事类招生计划？如果有，何处可以查询？,详见所在省报考指南
152,0,请问如报考贵校艺术学院音乐表演专演，是否应在提前录取批次对应栏目填报。,各省批次不同，详见所在省报考指南
153,0,我户籍在广东但在湖南参加的高考，录取分数是按湖南分数录取还是按广东分数？,详情咨询湖南省招办
154,0,请问文科专业调剂会被调剂到传播学的2+2联合班吗？如果被调剂到这个班，是不是必须出国学习两年呢？谢谢！,1有可能2.2年后可转回平行普通班
155,0,我647，今年本一批529，填报贵校需要参考,http://admission.scut.edu.cn/2020/0523/c17520a378753/page.htm参照我校2019年分数，同时掌握两年排位对比
156,0,广西理科应届考生，634分，含5分地方加分，排名广西2251，有希望录取吗？,http://admission.scut.edu.cn/2020/0523/c17520a378728/page.htm希望较大，建议报考，注意拉开梯度
157,0,我是广东文科生，请问分数598，排名2032有可能被贵校录取吗？,建议报考http://admission.scut.edu.cn/2019/0718/c17520a328738/page.htm注意专业冷热结合填报
158,0,高考理科，分数619分，可以报考贵校吗,http://admission.scut.edu.cn/2019/0718/c17520a328738/page.htm
159,0,请问广东高考分数615，省排13000有可能被贵校录取吗？调剂到冷门也可以,http://admission.scut.edu.cn/2019/0718/c17520a328738/page.htm2019年我校录取排名在10000名附近建议冲报，不过后续院校与我校需拉开梯度填报
160,0,老师您好，我是重庆文科考生，608分，排名大概在1262-1310.请问录取概率大吗？,建议报考，拉开梯度http://admission.scut.edu.cn/2020/0523/c17520a378758/page.htm
161,0,请问河北文科排名多少可以报考贵校？,http://admission.scut.edu.cn/2020/0523/c17520a378731/page.htm
162,0,"广东9100多名,有机会录取吗?",去年我校录取排位在10000名附近http://admission.scut.edu.cn/2019/0718/c17520a328738/page.htm建议报考，希望很大
163,0,河北省中国舞专业省考155文化480有希望上吗,http://admission.scut.edu.cn/2019/0708/c17520a327241/page.htm
164,0,老师好，我想问今年贵校会在广西理科招收多少名以内？,http://admission.scut.edu.cn/2020/0523/c17520a378728/page.htm
165,0,在农招过了的情况下，需要福建编导生文化分多少分才可以被录取？,很抱歉，我校不招编导专业。
166,0,请问一下美术生录取规则和分数线,http://admission.scut.edu.cn/2020/0331/c17747a370215/page.htm
167,0,老师您好，请问贵校去年在河南省高校专项的录取分数线是多少,http://admission.scut.edu.cn/2020/0529/c17520a379341/page.htm参照去年分数排位，注意拉开梯度
168,0,广东考生，请问服从调剂，是指仅在广东招生的专业内调剂？还是指在华工所有的招生专业里调剂？会调剂到华工在其他省份的招生专业么？,仅在广东招生的专业内调剂。我校今年对广东省考生有非常“6+1”政策，在广东省志愿填报结束后5天内（约8月2~7日，以官网为准），在我校招办官网（http://admission.scut.edu.cn/）可填报最不想去的专业（类），如果遇到调剂，则不会被调剂到这个非意向专业（类）。
169,0,请问贵校的2019年提前批和国家专项计划录取分怎么查不到呢,http://admission.scut.edu.cn/2019/0708/c17520a327240/page.htm
170,0,请问浙江考生报考贵校材料类，应该填报什么招生专业？谢谢！,可以先报考其他专业，入校后两周内参加材料类全英创新班（本硕、本博连读）的二次选拔，或者在第二学期结束时申请转专业。
171,0,1.贵校的转专业条件有哪些2.能否辅修双学位3.有没有研究生推免权4.大类招生分专业的具体条件谢谢老师,1.入校二次选拔要求相关学科（例如要求理科学生）；一年后全校范围内转专业转出无门槛条件，但要达到申请学院的转入门槛（每个学院都不同）；2.可以。学生在学期间如学有余力，可跨学院辅修专业、辅修学士学位。目前在校学生约有15%的学生修读辅修专业、辅修学士学位。学校开设辅修专业的有金融学、工商管理...[详细]
172,0,色弱在专业有很大的限制吗？,轻度色觉异常（俗称色弱）不能录取的专业：风景园林、材料类全英创新班、材料类(含高分子材料与工程、材料科学与工程、功能材料)、化学类(强基计划班)、化工与制药类(含应用化学、化学工程与工艺、能源化学工程、制药工程)、轻工类(含轻化工程、资源环境科学)、食品科学与工程类(含食品科学与工程、食...[详细]
173,0,上海考生，贵校的城乡规划要求加试素描，有具体考纲吗？是单个几何体还是多个几何体？是单个静物还是多个静物？,我校素描加试考的是组合体静物素描^_^
174,0,您好，今年河南省的招生名额有变动么？,今年我校在河南文理招生计划都略有增加^_^
175,0,我的预估分数为530，可以有国家专项计划，还有民族加分20分，请问能否可以冲一下这所大学,我校在广西省2019年理科国家专项分数线598分。但每年考试难易程度不一样，所以分数线每年会不同。待分数出来可以对比排位，用排位预估比较准。
176,0,贵校您好，请问录视频的场景有什么要求吗，可以在舞台吗？,请咨询艺术学院020-39380901
177,0,老师您好，请问：1、录制曲目有没有时长限制2、上传文件大小有无限制谢谢！,考题会有考试时长限制。视频在线实时录制
178,0,请问视频拍摄一定要用电脑吗？用手机能否操作？,自行测试，对录像效果满意即可
179,0,你好，我是广东省文科美术生，请问贵校文化控制线是按普通生还是艺术生设置？有没有单科成绩要求？招不招日语考生？,华南理工大学2020年设计学专业（艺术类）招生简章http://admission.scut.edu.cn/2020/0331/c17747a370215/page.htm
180,0,需要打印准考证吗,自行决定
181,0,请问学校定的时间是从17号到21号这几天都可以上传视频吗？还是每个人的时间段考试时间都有所不同?大概意思每天都有一定拍摄机会还是怎样?,都可以
182,0,请问考试时间是在“17号五点到21号的五点”当中任何一个时间进入系统考试都可以吗？？？,是的
183,0,请问广东音表古筝什么时候考试？？？,华南理工大学2020年艺术学院本科招生专业考试专业一试考试注意事项http://admission.scut.edu.cn/2020/0415/c17699a372443/page.htm
184,0,系统什么时候可以开放？会有时间彩排吗？准考证需要打印没？,华南理工大学2020年艺术学院本科招生专业考试专业一试考试注意事项http://admission.scut.edu.cn/2020/0415/c17699a372443/page.htm
185,0,管玄乐中提琴初试什么时候开始,2020年4月17日17:00—2020年4月21日17:00
186,0,请问排练次数有几次？正式考试次数有几次？,系统开放后自行查看
187,0,视频录制有时长限制吗？声乐表演的歌曲是一起录还是一首一首录？什么时候能试录？考试的时候可以录几次？,进入系统后根据要求
188,0,1.打开相关网址显示“你不在学校上传的准考名单中”2.可以用手机实时录制上传吗还是一定要用笔记本？3.下载了学信网app没有艺术类的相关入口如何操作？麻烦老师了,网校系统还未开放；只要设备支持都可以，自行评估；学信网App是实人验证的不是考试，请仔细阅读操作手册
189,0,请问用手机进入远程考试系统录视频可以上传吗？一定要用笔记本电脑录吗？,系统是允许的，只要你测试觉得可以就可以
190,0,请问是在审核时间内上传作品吗？还是进去系统内不是上传视频直接实时的录制视频然后提交？？,是的，直接在线录制上传
191,0,准考证打印仍然无准考信息，是否还没开始？,开始了
192,0,请问高校的声乐表演一试的时间确定是那天呢？,2020年4月17日17:00—2020年4月21日17:00
193,0,什么时候可以打印准考证呀,现在
194,0,人脸识别已经通过但不能提交，系统显示“你不在学校上传的准考名单中，若有疑问请联系报考学校”,我校暂时还未开放，先熟悉操作吧
195,0,1,2020年4月17日17:00—2020年4月21日17:00
196,0,现在打不通你们的电话？,工作时间都是有人接听的
197,0,请问，我的曲目是有一部分是要重复演奏的，请问考试的时候需要重复吗,请咨询艺术学院020-39380901
198,0,（钢琴表演）我想问一下录制视频时演奏前需要介绍自己吗？需要鞠躬吗？还是直接开始弹？背景有没有什么要求（比如白墙）？,不需要，直接按要求开始表演
199,0,老师好，想问问今年甘肃音乐报名多少人，多少个合格证，录取多少人,合格证全国统一划线
200,0,请问西洋管弦的初试中，我看音阶要求是大小调音阶和琶音，意思是只需要演奏大小调的主音阶和琶音对吗？三度和分解和弦不用考吗？,以简章和通知要求为准
201,0,手机下载的学信网和电脑版不一样，找不到阳光高考信息平台，无法提交视频。但通过微信进入学信网可以找到，正式考试时怎么办？,学信网App只是辅助进行实人认证的，手机也是要用浏览器访问考试系统网址
202,0,我已经在平台报名，现在的状态是打印准考证，但是无法打印，系统提示联系志愿学校，请问什么时候可以打印准考证，谢谢,这两天
203,0,什么时候初试？,18日左右
204,0,我想问一下音乐学专业的初试是乐曲一首，但是我报名的时候报了一首练习曲可以吗,以考试系统实际表演及填报的为准
205,0,具体考试时间是啥时候?到时录制是在指定网站上录还是考试那天用自己手机录好上传上去,在线录制
206,0,你不在学校上传的准考名单中，若有疑问，请联系报考学校。。。。,我校目前尚未开放考试，请先仔细阅读系统“考生使用说明”
207,0,用什么软件录制学信网不行啊？,艺术类招生作品远程提交系统
208,0,您好，请问考试时间是会提前多久告知？比如十八号考试，会提前到几号通知考生呢？因为这样有些需要提前找场地的学生易于安排行程，大概说提前一天还是两天就好了，谢谢。,提前一两天即可
209,0,视频录制是提前录好发，还是说是在线录发？,在线录制
210,0,老师甘肃省的考试时间是什么时候18号-20号吗？,18日左右
211,0,您好！一月已经在甘肃省教育考试院交过费了，为什么在艺术类招生作品远程提交系统显示未在学校准入名单中呢,我校考试暂时还未开放
212,0,现在那个系统上面显示没有相关准考证信息，打印不了是什么问题？那个视频录制是要在考试当天录制还是可以在规定的日期之前提前录制？,在线录制
213,0,"为什么我已缴费成功，却显示""你不在学校上传的准考名单中，若有疑问，请联系报考学校。""",我校考试暂时还未开放
214,0,请问音乐器乐演奏考生选修了艺术外的专业，毕业证怎么发的,请咨询艺术学院020-39380901
215,0,您好，请问已缴费的广东省声乐专业考生的准考证以及考试时间大概多久发布？,这几天
216,0,请问贵校美术设计学类专业在湖南的招生是文科生和理科生按综合分合在一起排序录取的，还是文科和理科分开排序录取？,分开
217,0,考试时间定在几时呀，啥时候开通系统给我们排练排练,18日左右
218,0,着装可以穿日常服装吗？想直接在家拍，纯色背景可以吧？,可以
219,0,贵校在河北招生吗,华南理工大学2020年艺术学院本科招生简章http://admission.scut.edu.cn/2019/1228/c17747a360339/page.htm
220,0,为什么我报名交了费之后，进入远程提交作品说我不在学校上传的准考名单中?,交费还没截止
221,0,现在还可以报名吗招重庆的音乐生看那个艺术升那个软件好像可以报名大概文化录取分是多少呢^^,报名已经结束了
222,0,河北音乐招生报名结束了吗,结束了
223,0,为什么我缴了费报了名在艺术类作品远程提交系统里登陆显示我不在学校上传的准考名单中,交费还未结束
224,0,老师你好我电话没人接请问可以用即兴伴奏吗,请在工作日（周一至周五拨打）
225,0,线上考试需要伴奏吗？,请咨询艺术学院020-39380901
226,0,要打印准考证吗？什么时,考试前可以打印
227,0,您好，请问广东音乐表演类声乐考生何时能知道自己的考试时间和准考证打印时间？远程视频提交系统何时开放呢，好让我们有一个适应的时间。谢谢,考试前
228,0,1,请咨询艺术学院020-39380901
229,0,建议初试和复试时间相隔至少一周,建议已收到
230,0,我是河北考生，请问贵校何时交一、二试的视频？在什么平台上交？,华南理工大学关于调整2020年艺术学院本科招生专业考试方案的通知http://admission.scut.edu.cn/2020/0331/c17699a370225/page.htm
231,0,报名入口在哪儿呀,报名已经结束
232,0,为什么打不开，需要下载什么,可以先下载学信网app到手机
233,0,歌曲能不能不反复，就是一次性唱完不重复唱？因为歌曲重复的部分,请咨询艺术学院020-39380901
234,0,我是甘肃考生，贵校什么时候线上考试？,4月18日左右，具体时间安排还未最终确定，
235,0,学校报名能否重开？都没有看到有相关的通知就结束了,报名已经结束。通知早在1月份就已经发布。华南理工大学2020年艺术学院本科招生专业考试广州考点报名通知http://admission.scut.edu.cn/2020/0110/c17699a361307/page.htm
236,0,广州考点的缴费怎么缴,之前报名成功的在报名系统交费
237,0,报名截止时间不是4.12下午五点莫，河北声乐,报名之前就已经结束
238,0,找不到报名入口怎么办,报名已经结束
239,0,您好，我想问问河北省声乐生，能报名校考莫，是分省招生莫,校考报名已经结束
240,0,请问招湖北音乐生吗？,音乐学专业、音乐表演专业招生范围：河南、江西、甘肃、广东、河北、湖北、湖南、海南、重庆、四川、陕西。华南理工大学2020年艺术学院本科招生简章http://admission.scut.edu.cn/2019/1228/c17747a360339/page.htm
241,0,器乐演奏专业学生可以选修哪些专业？,请咨询艺术学院020-39380901
242,0,可以用即兴伴奏吗,请在工作时间咨询艺术学院020-39380901
243,0,声表一试歌曲上传视频有时间限制吗？曲子要完整吗，可不可以不反复？,有时间限制，反复是什么意思
244,0,请问器乐演奏专业考生专业过去了文化要求多少,华南理工大学2020年艺术学院本科招生简章http://admission.scut.edu.cn/2019/1228/c17747a360339/page.htm
245,0,Chrom浏览器在中国是搜狐浏览器，可否用搜狐浏览器？,学信网推荐Chrome浏览器，系统开放后你可以自行测试
246,0,请问管玄乐演奏专的的学生可以另外选修艺术外的专业吗？,可以辅修
247,0,贵校是否重新开启报名系统,报名已经结束
248,0,您好，请问必须使用Chrome浏览器进行操作嘛？您提到的实时录制是指在浏览器内登录学信网进行线上录制么，谢谢。,是学信网“艺术类招生作品远程提交系统”（https://bm.chsi.com.cn/）线上录制。考前可以自行测试浏览器。学信网推荐：使用笔记本电脑进行考试，安装最新版Chrome浏览器（下载： Mac版https://www.google.cn/chrome/、 Windows版https://www.google.cn/chrome/。 IOS用户请使用Safari最新版浏览器；安卓用户请使用Chrome最新版浏览器（下载https://t4.chei.com.cn/common/app/chrome-80-0-3987-162.apk）
249,0,请问艺术学院的电话咨询时间是什么时候，打电话一直都没人接,应该是9:00-12:00;14:00-17:00
250,0,怎样知道自己的设备是否支持Chrome浏览器？,使用笔记本电脑进行考试，安装最新版Chrome浏览器（下载： Mac版https://www.google.cn/chrome/、 Windows版https://www.google.cn/chrome/。 IOS用户请使用Safari最新版浏览器；安卓用户请使用Chrome最新版浏览器（下载https://t4.chei.com.cn/common/app/chrome-80-0-3987-162.apk）
251,0,那个上传怎么搞，第一次这样考不太懂操作，有没有具体的讲解,后续会有通知
252,0,1,需要到下周
253,0,二胡演奏,综合考虑
254,0,二个问题。1、如果用手机实时录制，录制中途如果有电话打入，那就会直接影响录制效果，到时能否重头再录一遍。2、方案通知里说实时录制也可以用WINDOWS电脑进行操作，是指通过学信网用电脑自带的摄像头进行实时录制吗？可否外接收音设备？对录制的格式有什么要求？这些问题在方案里都没有明确...[详细],可以用电脑。
255,0,声乐表演一试是两首声乐作品二选一唱吗?是会提前指定吗?,不是，两首都要唱
256,0,实时考试具体是什么意思？如果当时考试中调试操作失误怎么办？,有排练的机会
257,0,毕竟大家都是第一次操作，操作上的还有待时间去适应,需要等学信网设置
258,0,请问伴奏是需要钢琴伴奏还是网上下载的伴奏呢？,请咨询艺术学院020-39380901
259,0,考试系统只能用Chorme?能不能用Firefox,学信网推荐使用Chorme
260,0,请问贵校即将举行的广州考点声乐表演线上考试，是可以提前录制视频还是当场直播考试呢？伴奏的话是能自己找钢伴老师还是自己放伴奏呢？还有之前报名了的歌能换成其他作品考试吗？谢谢！,实时录制上传。伴奏请咨询艺术学院020-39380901
261,0,我问一下华南理工大学音表声乐初试合格分是多少？,专业一试结果为合格与不合格
262,0,音乐学二试的现场知识问答和面试演唱各占成绩的多少比例呢?,综合评分
263,0,请问贵校2017、2018、2019年在北京的艺术类（美术）文史最低录取线，最高分和最低分的分差以及最高分位次和最低分位次。（以此问题为准）,我校未招收北京艺术类（美术）考生
264,0,线上考试还需要钢伴吗？还是说直接放伴奏就可以？有没有什么服装和形象方面的要求？比如不能化浓妆穿礼服什么的？,服装没有要求，考试前有实人认证，请勿影响实人认证。伴奏请咨询艺术学院020-39380901
265,0,音乐学专业的成绩各占的比例是多少?我看通知上说的不是很清楚，一试的钢琴曲演奏是要求完整的吗?还有音乐表演和音乐学的一试会算入总成绩吗?,按完整的准备，有一定的考试时间。一试不算入二试。
266,0,在学信网报了华工艺术学院的音乐表演专业校考，已缴费，系统显示下一步是打印准考证，一试上传视频作品，请问：需要先打印准考证吗？但如何通过学信网系统打印准考证呢？具体要求是操作？,考试时间未定，请继续关注
267,0,声乐表演专业录制视频时可以穿礼服吗?是提前录制还是直播考试呢?,服装没有要求，实时录制上传
268,0,在报名系统上提示打印准考证，但无准考信息，是学校还未安排吗？,考试时间还未确定，暂时还不行
269,0,你好，考试的曲目可以进行删减吗？还是要求全曲弹完？,以考试系统内要求为准
270,0,广州考点还可以报名吗？,报名已经结束
271,0,音乐表演演唱时可以钢伴吗？,请咨询艺术学院020-39380901
272,0,线上统一考试是先录制好视频上传，还是在规定时间录好上传？,实时录制上传
273,0,声乐视频录制是否能够用专业仪器设备呢？录视频的时候钢伴老师是否能够入镜？,不能
274,0,我想改曲目,报名系统不能修改
275,0,考声乐的时候，一定要求是正谱伴奏吗？还是即兴伴奏也可以?,请咨询艺术学院020-39380901
