ID,标签,标题                             ,问题                                                                                                                                                                  ,答案                                                                                                                                            ,省份 ,年份
5 ,0 ,能否转专业                          ,是否可以转专业？                                                                                                                                                            ,可以                                                                                                                                            ,广东 ,2021
6 ,0 ,安徽理工考生                         ,"2021年会安徽理工433分，排位141231,有希望被贵校录取吗？如服从调剂，最有希望的是什么专业哪个校区就读？谢谢！"                                                                                                      ,2020年的招生有人退档，导致后面补录补到的最后一名排名过低，所以2020年的录取排位名次，没有很大的参考价值。建议参考往年的，安徽都在一本线上下录取。                                                                  ,安徽 ,2021
7 ,0 ,录取                             ,你好，我是广东省历史系考生，省排三万七，请问被您校录取的可能性大吗？有专业符合吗？                                                                                                                           ,希望挺大。具体可报专业请查看我校招生计划。                                                                                                                         ,广东 ,2021
8 ,0 ,安徽考生                           ,安徽理工433分可以报考贵校吗？录取概率大不大？会在哪个校区就读？专业分数高不高？                                                                                                                           ,2020年的招生有人退档，导致后面补录补到的最后一名排名过低，所以2020年的录取排位名次，没有很大的参考价值。建议参考往年的，安徽都在一本线上下录取。                                                                  ,安徽 ,2021
9 ,0 ,录取                             ,您好，广东历史方向525，排名32233，医学方面的专业往年没有数据参考，可以建议一下那些医学方面的专业可以选择的吗？                                                                                                         ,文科生可读的医学方面专业，请查看招生计划表                                                                                                                         ,广东 ,2021
10,0 ,转专业                            ,进校后可以申请转专业吗                                                                                                                                                         ,可以                                                                                                                                            ,广东 ,2021
11,0 ,转专业                            ,进校后可以申请转专业吗                                                                                                                                                         ,可以                                                                                                                                            ,广东 ,2021
12,0 ,视力                             ,请问贵校，我近视，体检报告写我是3.9，可是我因为散光，导致裸眼视力很低，但实际我近视度数矫正只达到175，这会影响我的报考吗？                                                                                                    ,部分专业不招色盲色弱。具体请查看招生计划。                                                                                                                         ,广东 ,2021
13,0 ,专业组                            ,关于专业组207021药学专业，是不是志愿不填报，就不会录取？或者说，最后也不会被调剂到这个专业？                                                                                                                   ,是的。药学国际班只招收填报了志愿的考生，其他考生不会调剂到这里。                                                                                                              ,广东 ,2021
14,0 ,广东物理考试录取                       ,广东物理考试排名103165有机会吗                                                                                                                                                  ,结合往年情况和今年招生实际，建议广东省内理科排名12.5万名左右，文科4万名的考生左右大胆报考。理科13.5万名左右，文科4.5万名左右的考生大胆冲一冲。                                                                 ,广东 ,2021
15,0 ,请问我历史类总分502排名48554有机会上你们学校吗？   ,请问我历史类总分502排名48554有机会上你们学校吗？                                                                                                                                        ,结合往年情况和今年招生实际，建议广东省内理科排名12.5万名左右，文科4万名的考生左右大胆报考。理科13.5万名左右，文科4.5万名左右的考生大胆冲一冲。                                                                 ,广东 ,2021
16,0 ,考研和转专业                         ,贵校在考研是怎样的安排以及如何转专业，理科生进去的可以转文科生专业吗                                                                                                                                  ,考研学生自主安排，学校老师学姐学长有相关经验指导。转专业请查看我校教务处网站。                                                                                                       ,广东 ,2021
17,0 ,扩招                             ,请问贵校扩招的话，预估排位和分数是多少呢？如果录取不够，会在预估分数降低多少分录取呢                                                                                                                          ,结合往年情况和今年招生实际，建议广东省内理科排名12.5万名左右，文科4万名的考生左右大胆报考。理科13.5万名左右，文科4.5万名左右的考生大胆冲一冲。                                                                 ,广东 ,2021
18,0 ,扩招                             ,请问今年扩招，分数线会不会下降呢？大概会下降多少呢？范围是多少？                                                                                                                                    ,结合往年情况和今年招生实际，建议广东省内理科排名12.5万名左右，文科4万名的考生左右大胆报考。理科13.5万名左右，文科4.5万名左右的考生大胆冲一冲。                                                                 ,广东 ,2021
19,0 ,老师您好                           ,请问广东历史考生排名42021被贵校录取机会大吗                                                                                                                                            ,结合往年情况和今年招生实际，建议广东省内理科排名12.5万名左右，文科4万名的考生左右大胆报考。理科13.5万名左右，文科4.5万名左右的考生大胆冲一冲。                                                                 ,广东 ,2021
5 ,0 ,广东选历史的分数520排位35918能上护理学吗       ,之前广东旧高考护理学只能是理科选，现选历史也可以选了，排位按照理科排位？                                                                                                                                ,结合往年情况和今年招生实际，建议广东省内理科排名12.5万名左右，文科4万名的考生左右大胆报考。理科13.5万名左右，文科4.5万名左右的考生大胆冲一冲。                                                                 ,广东 ,2021
6 ,0 ,录取                             ,广东文科生509分43302名有机会报考吗                                                                                                                                               ,结合往年情况和今年招生实际，建议广东省内理科排名12.5万名左右，文科4万名的考生左右大胆报考。理科13.5万名左右，文科4.5万名左右的考生大胆冲一冲。                                                                 ,广东 ,2021
7 ,0 ,校区问题                           ,老师你好，我想报考本校的广州校区中的大学城校区，但本校在在广州有三个校区，该如何填报专业才能到大学城？大学城中又有什么专业？                                                                                                      ,我校2021年招生计划已经将三校区专业很明确地区分开了，请上我校招生网查询。                                                                                                        ,广东 ,2021
8 ,0 ,校区                             ,如果被贵校的护理学录取，会在哪个校区就读？                                                                                                                                               ,请以我校公布的2021年招生计划为准，校区专业都有明示。                                                                                                                  ,广东 ,2021
9 ,0 ,排名                             ,老师，您好！请问2021年历史类排位为多少的考生可以冲报贵校?                                                                                                                                     ,结合往年情况和今年招生实际，建议广东省内理科排名12.5万名左右，文科4万名的考生左右大胆报考。理科13.5万名左右，文科4.5万名左右的考生大胆冲一冲。                                                                 ,广东 ,2021
10,0 ,专业                             ,安徽省的学生可以报临床吗                                                                                                                                                        ,请查看我校2021年招生计划                                                                                                                                ,安徽 ,2021
11,0 ,高考咨询                           ,你好，我是广东的考生我想问一下贵校1.转专业的条件2.能不能修双学位3.人力资源管理专业和健康服务与管理专业分别在哪个校区就读4.选专业的具体条件5.录取时是否设置专业级差和调档比例？最后想问问广东的考生录取几率大吗                                                        ,1、转专业，请到我校教务处网站查询2、可以双学位3、具体哪个专业哪个校区请查看我校公布的招生计划4、招生计划中说明了专业录取条件5、没有级差，比例1/16、录取几率大不大，请参考往年录取分数线                                              ,广东 ,2021
12,0 ,考研率                            ,请问贵校的考研率一般是多少？                                                                                                                                                      ,考研不算太多人，但这个问题主要是看学生自己。                                                                                                                        ,广东 ,2009
13,0 ,如何转专业？                         ,虽然转专业“要求较高”且贵校“不建议”，但仍想咨询一下：1.怎样才能转专业？2.具体要求是什么？3.转专业时贵校有没有参考学生的高考成绩或在大学的成绩？4.转专业需要哪些手续？以上四个问题请正面回答，不要回避。谢谢！                                                        ,具体要求、手续请你咨询我校教务处。本办公室建议你还是一步到位，填好自己的志愿，不要进校以后再来申请转专业，确实要求较高。                                                                                  ,广东 ,2009
14,0 ,专业问题                           ,请问贵校往年报考人数较少或低于计划数的专业有哪些？                                                                                                                                           ,暂时没有统计                                                                                                                                        ,广东 ,2009
15,0 ,专业录取分数                         ,请问贵校的如下几个专业录取分数一般比二A线高多少分（理科考生）：1.临床医学（5年）（008）2.临床医学（全科医学）（5年）（030）3.临床医学（中西医临床医学）（5年）（043）4.预防医学（5年）（012）5.食品质量与安全（053）6.食品科学与工程（062）7.药学（005）8.药学（医院药学）（01...[详细],请看：http://gaokao.chsi.cn/sch/viewHireInfo.do?schId=438&infoId=18700282&categoryId=379550&mindex=6                                             ,广东 ,2009
16,0 ,咨询                             ,"我是云南的理科考生,分数比云南二本线高50分,请问可以报考贵校吗?"                                                                                                                                 ,按往年情况，这个分数报考我校是有希望的。                                                                                                                          ,云南 ,2009
17,0 ,报考贵校                           ,您好，我想请问一下，我是甘肃的文科考生，今年的甘肃分数线是466。我是447.5，如果第一志愿报贵校，又没有被录取的可能？谢谢您，等待您的答复                                                                                             ,这刚接近二本线报考我校希望较小。                                                                                                                              ,甘肃 ,2009
18,0 ,本校的主要专业                        ,"请问老师,您校的主要专业是否是医学专业"                                                                                                                                               ,药学、预防医学专业。                                                                                                                                    ,贵州 ,2009
19,0 ,学校是否为学生找到工作                    ,贵校学生在毕业后学校是否为学生找到工作                                                                                                                                                 ,学校不包就业，工作主要靠学生自己找。                                                                                                                            ,广东 ,2009
5 ,0 ,专业                             ,请问，如果专业不合适可以转吗，，如果转去原来是文史累的么？谢谢                                                                                                                                     ,转专业要求比较高。限制在同种选考科目内。                                                                                                                          ,广西 ,2009
6 ,0 ,报考贵校                           ,"我是广西理科考生,分数刚刚上二本线,请问可以报考贵校吗?能录取的机会大吗?"                                                                                                                             ,如省外报考我校分数高出二本线一、二十分会保障一点。                                                                                                                     ,广西 ,2009
7 ,0 ,咨询                             ,河北理科，成绩537分，能上贵校吗？                                                                                                                                                  ,没有贵省的二本线，无法比较。                                                                                                                                ,河北 ,2009
8 ,0 ,广西                             ,老师您好，，我是广西理科的，，高二本十几分报贵校希望大吗？                                                                                                                                       ,按去年，理科，是有希望的。                                                                                                                                 ,广西 ,2009
9 ,0 ,甘肃考生专业问题咨询                     ,老师你好我是甘肃文科考生（女），贵校只在甘肃招国际经济与贸易（英语特色）一个专业，请问该专业对考生视力有无特殊要求，比如眼睛度数。看招生章程后没完全理解。谢谢                                                                                     ,对视力没有特殊要求。                                                                                                                                    ,甘肃 ,2009
10,0 ,你校有“专升本吗？”                     ,"老师你好,我是广东理科考生,请问：1、你校07和08年各专业招生录取分数线（最高分、最低数）2、你校有“专升本吗？”谢谢"                                                                                                      ,分数线可以本网页的介绍内容看到。另，2009年还有专升本。                                                                                                                 ,广东 ,2009
11,0 ,毕业后就业率及就业方向                    ,请问贵校近5年毕业后的就业率及就业城市方向。                                                                                                                                              ,近几年我校就业率达95%以上，就业城市多在珠三角。                                                                                                                     ,广东 ,2009
12,0 ,报贵校的预防医学专业                     ,我考了560想报贵校的预防医学专业，我的分数够吗？如果我考上预防医学专业，以后可以报考临床类别医师，从事临床诊断，拥有处方权吗？                                                                                                    ,预防医学不是临床医学，没有处方权之说。另，未知您是哪个省份考生，无法对您的分数做出估计。                                                                                                  ,河南 ,2009
13,0 ,学校外语课以英语教学为主的咨询                ,贵校《招生章程》中写到“学校外语课以英语教学为主。”请问其它课是否一律采用中文教学？                                                                                                                          ,除特殊专业(如英语特色班)有些课程是用英语教学外，其它课程主要以中文教学为主。                                                                                                       ,广东 ,2009
14,0 ,硕士学位授予权                        ,贵校《招生章程》中写到“学校具有硕士学位授予权。”请问是仅校本部才有还是其它校区都有？                                                                                                                         ,硕士授予权不分校区，只视专业。                                                                                                                               ,广东 ,2009
15,0 ,关于专业安排的咨询                      ,1.对于服从其它专业的考生，当第一志愿专业的人数录取满额时，贵校进行专业调制时是随便调制还是调到与第一志愿专业相近的专业？调制如果不满意是否有补救措施？如果有，具体是什么？2.入学后能否转专业？如报考药学类专业并被录取后能否转临床医学专业？3.能否选修或辅修其它专业？如果可以...[详细]                   ,一、填服从，尽量按相近专业录取二、可转专业，但要求较高，不般不建议转。三、有能力不限制选修四、没有级差。                                                                                          ,广东 ,2009
16,0 ,关于录取的咨询                        ,一、请问贵校录取时对于达到最低录取控制分数线以上第一志愿的考生有没有按照从高分到低分的顺序录取？二、对于达到最低录取控制分数线以上第一志愿的考生，贵校在录取的时候有没有参考高中时选考的X科科目？具体点问：对于X科为物理、化学、生物的考生，贵校在录取的时候有没有更倾向于录取...[详细]                     ,一、上了线、在志愿内按高分到低分录取二、可选考科目内不再区分专业                                                                                                              ,广东 ,2009
17,0 ,今年新增的临床医学的代码？                  ,在媒体上看到贵校今年新增了临床医学专业，请问专业全称及其方向以及专业代码是多少？                                                                                                                            ,临床医学非新增专业。临床医学　理工008临床医学全科医学理工030中西医临床医学理工043 上表最后的数字是相关专业代码。                                                                                 ,广东 ,2009
18,0 ,关于浙江理科招生的问题                    ,"第二类招多少人,分数多少?"                                                                                                                                                     ,视当地省线及报考人数而定。                                                                                                                                 ,浙江 ,2009
19,0 ,广西                             ,我想问下，贵校在广西的分数线，去年是多少，，是最低分是分数线么？                                                                                                                                    ,省份第二批本科分数线录取人数平均分最高分最低分广西文史4702518519517理工44010476504442                                                                                      ,广西 ,2009
5 ,0 ,报贵校                            ,我是河南的考生，现估分550左右，在二本线以上，想报贵校，又怕录取不了，以你的经验我能录取吗？                                                                                                                     ,如果分数高出二本线二、三十分以上机会就大一点。                                                                                                                       ,河南 ,2009
6 ,0 ,一本线上十分报二本                      ,老师您好：我是江西理科考生，本次三模考试权重估分在一本线上10分。请问如果我报贵有希望被录取吗？谢谢                                                                                                                  ,分数在一本以上，报考我校应该没问题。                                                                                                                            ,江西 ,2009
7 ,0 ,广东药学院                          ,请问贵校转专业的条件，护理可以转临床吗                                                                                                                                                 ,如果你是想读临医的，可以直接报临医专业。转专业条件高，一般不建议转。                                                                                                            ,河南 ,2009
8 ,0 ,渴望                             ,我考砸了，只有514分，能进你们学校吗？                                                                                                                                                ,如果理科，按往年的情况第一志愿应该有机会被录取。                                                                                                                      ,广东 ,2008
