ID,标签,标题                             ,问题                                                                                                                                                                  ,答案                                                                                                                                            ,省份 ,年份
3 ,0 ,报考咨询                           ,老师您好！我是安徽考生，今年安徽本科第二批批次线是415分，我的成绩是429，高14分，请问报考第一志愿贵校录取的可能性大吗？或者报考哪些专业可能性会大一点呢？去年断档的情况下，今年是不是录取分数线会提高很多呀？期待您的答复！                                                   ,2020年的招生有人退档，导致后面补录补到的最后一名排名过低，所以2020年的最低录取排位名次，没有很大的参考价值。建议参考往年的录取最低分，也可参考录取平均分，这个分数比较符合实际情况，安徽一本线上下都可以填报。                                   ,安徽 ,2021
4 ,0 ,安徽招生预测                         ,老师您好！我想请问一下，贵校今年在安徽招生大概准备最低多少分呢？或者最低排名吗？                                                                                                                            ,2020年的招生有人退档，导致后面补录补到的最后一名排名过低，所以2020年的最低录取排位名次，没有很大的参考价值。建议参考往年的录取最低分，也可参考录取平均分，这个分数比较符合实际情况，安徽一本线上下都可以填报。                                   ,安徽 ,2021
5 ,0 ,录取                             ,"你好,我是广东考生,想报贵校的药物制剂.请问去年该专业录取最低分是多少?"                                                                                                                              ,我校2005年药物制剂专业录取最低分是585分、平均分为600分。                                                                                                             ,广东 ,2006
6 ,0 ,国际贸易与英语                        ,"读完4年,将来可以做什么?这个专业有什么优势?"                                                                                                                                           ,详情请浏览我校招生网页http://zsb.gdpu.edu.cn下招生简章中的专业介绍。国际贸易与英语特色班的优势是很多课程采用双语教学，英语水平较高，有一定的优势。                                                          ,广东 ,2006
7 ,0 ,是否只招第一志愿？                      ,如果第二志愿填报贵校，专业级差是多少？                                                                                                                                                 ,根据广东省今年的报考情况和我校今年的招生计划，我校不一定会录取第二志愿考生，具体到时正式招生时才能决定。专业间没有级差。                                                                                  ,广东 ,2006
8 ,0 ,你好，老师                          ,老师，你好，我是位学生家长，我想咨询下咱们学校生物类专业有哪些？这些专业在咱们广东前两年的录取情况大概是个啥样子？谢谢你                                                                                                        ,详情请浏览我校招生网页http://zsb.gdpu.edu.cn下招生简章中的专业介绍、招生问答等。                                                                                           ,广东 ,2006
9 ,0 ,你好，老师                          ,我是位学生家长，我想咨询下咱们学校生物制药专业前两年在咱们广东的录取情况，谢谢你                                                                                                                            ,详情请浏览我校招生网页http://zsb.gdpu.edu.cn下招生简章中的专业介绍、招生问答等。                                                                                           ,广东 ,2006
10,0 ,关于第二志愿                         ,请问贵校往年有招第二志愿的学生吗？级差分多少？                                                                                                                                             ,根据广东省今年的报考情况和我校今年的招生计划，我校不一定会录取第二志愿，具体到时正式招生时才能决定。专业志愿之间没有级差。                                                                                 ,广东 ,2006
11,0 ,请问你学校去年专科多少分开始投挡？              ,？？？                                                                                                                                                                 ,我校2005年专科最低出档分为516分，今年招生计划减少录取分数会较高。                                                                                                          ,广东 ,2006
